	text
539	and many users and influencers are worried about the platform as they were getting used to this platform it is 
540	toon finance dogecoin shiba inu coin moon after elon musk seals twitter purchase blockchain cryptocurrency news
541	elon musk twitter closes offices until next week breaking breakingnews politics usa news newsbreak trending 
542	elon musk is already thinking about stepping away from twitter topstories news popculture
543	 best people are staying m not worried elon musk amid mass resignations at twitter news dailyhunt 
544	elon musk shares this meme as mass resignations hit twitter triggering fear of global outage elonmusk twitter 
545	as twitter future appears unstable under new ownership many users are flocking to mastodon which has seen s 
546	 news via nyt by ryan mac mike isaac and david mccabe resignations roil twitter as elon musk tries persuading so 
547	the news at is news source the guardian title twitter closes offices after elon musk loyalty oath sp 
548	twitter enters death spiral as staff reject elon musk hardcore ultimatum image credit nathan dumlao on unspl 
549	elon musk twitter locks staff out of offices until next week news topstories bbc
550	twitter closes offices after elon musk loyalty oath sparks wave of resignations must read last paragraph news
551	after elon musk ultimatum twitter employees start exiting news tech technology technews 
552	 resignations roil twitter as elon musk tries persuading some workers to stay via trending news
553	elon musk changed like buttons viraltwitter news trendingnow 
554	twitter saga mass resignations on thursday elon musk suspends office access till nov elonmusk kyliebytes 
555	resignations roil twitter as elon musk tries persuading some workers to stay the new york times 
556	the news at is news source daily mail title twitter workers brace for fresh layoffs as they hit elon mus 
557	employees resign from twitter after elon musk deadline to recommit and walks back remote work policy news
558	elon musk takes the stand to defend his tesla compensation socialmedia news breakingnews
559	twitter living wake kicked off with elon pm deadline science tech culture reviews 
560	another worker exodus at twitter as many reject elon musk ultimatum breaking breakingnews politics usa news 
561	twitter employees quit in droves breaking breakingnews politics usa news newsbreak trending entertainment 
562	 twitter shuts offices in resignation chaos after elon musk ultimatum news information 
563	elon musk twitter closes offices until next week news topstories bbc
564	twitter employees quit in droves after elon musk ultimatum passes gt technews technology news
565	elon musk twitter closes offices until next week bbc news 
566	if elon musk lets twitter die its because he a bitchless loser with reverse hairline spread the news 
567	the news at is news source daily mail title twitter workers brace for fresh layoffs as they hit elon mus 
568	 in the news at pm elon musk twitter closes offices until next week
569	 in the news at pm elon musk twitter closes offices until next week
570	twitter halts office building access as reports emerge that hundreds of employees are leaving the company after el 
571	the news at is news source daily mail title twitter workers brace for fresh layoffs as they hit elon mus 
572	fired by tweet elon musk latest actions are jeopardizing twitter experts say npr elonmusk twitter 
573	elon musk twitter closes offices until next week hit radio charlie 
574	 hit with mass resignations after elon musk hardcore ultimatum america usa news 
575	twitter halts office building access as reports emerge that hundreds of employees are leaving the company after el 
576	future proof google news follow us for latest news twitter hit with mass resignations after elon mu 
577	hundreds of employees say no to being part of elon musk extremely hardcore twitter 
578	just in case em breaks twitter ve just signed up to mastodon as social musk 
579	future proof google news follow us for latest news elon musk changes twitter remote work rules 
580	breaking news alex vieira applauds elon musk firing thousands of useless twitter employees ftx news bitcoin 
581	elon musk sets more in office requirements at twitter threatens lax managers via cnbc news cnbc
582	senator asks elon musk to explain twitter impersonators web news money money
583	 tsla news update yesterday rueters today electrek more chatter of musk replacement hence the weakness 
584	elon musk sets more in office requirements at twitter threatens lax managers via cnbc news cnbc
585	 remote working will end elon musk tells staff via africans 
586	 tech newsflash it already failing nbc news special investigates meltdown at twitter can it survive 
587	monsters critics jimmy fallon asked elon musk for help with viral death hoax hashtag to no avail crime news
588	elon musk sets more in office requirements at twitter threatens lax managers via cnbc news cnbc
589	elon musk new email pushes twitter managers to do his dirty work science tech culture 
590	 democratic lawmakers call for investigation of elon musk twitter by by david mccabe via nyt new york times 
591	twitter engineer who was fired publicly by elon musk and locked out of his laptop calls the company bunch of cow 
592	elon musk was an unlikely flight risk at tesla when pay package came together his brother said via wsj news wsj
593	conspiracy theorists flood fcc with complaints about elon musk starlink news spacex elonmusk starlink
594	new article from teslarati conspiracy theorists flood fcc with complaints about elon musk starlink 
595	 tech newsflash fired by tweet elon musk latest actions are jeopardizing twitter experts say 
596	so tell me fucking american sucker how are you doing in the markets isn elon musk picks working for you 
597	 tsla news update yesterday rueters today electrek more chatter of musk replacement hence the weakness 
598	former spacex employees file labor complaints alleging retaliatory firings by elon musk company 
599	elon musk takeover of twitter has translated into huge user growth for upstart social media platforms like mast 
600	fired spacex employees file charges with national labor relations board science tech 
601	metro spacex employees say they were fired for speaking up against elon musk news tech spacex 
602	twitter granted fast track trial in bid to force elon musk to complete bn takeover read more 
603	twitter granted fast track trial in bid to force elon musk to complete bn takeover read more 
604	fired by tweet elon musk latest actions are jeopardizing twitter experts say gt technews technology news
605	u senator warns elon musk over issue via usa fintech 
606	he quite vain spacex employees say they were fired for speaking up about elonmusk news today
607	elon musk lays out options for remaining twitter employees click yes or you re done 
608	 news via nyt by noam scheiber and ryan mac spacex employees say they were fired for speaking up about elon musk 
609	 written by blockchaingist elon musk ceo of tesla and owner of twitter inc has made of dogecoin doge inv 
610	 spacex employees say they were fired for speaking up about elon musk via trending news
611	elon musk tesla compensation trial turns to financial experts via wsj news wsj
612	elon musk takes hard line on quiet quitters and anyone he thinks is close via wsj news wsj
613	elon musk robot taxis will be here sam bankman fried ftx is giving away billions to american turds ftx 
614	elon musk righthand man at tesla has reportedly joined spacex after the electric car maker launched an investigat 
615	 tech newsflash don get scammed why you can trust elon musk twitter right now technology bot news
616	 tech newsflash elon musk runs companies and his executive juggling act is the perfect example of how th 
617	 tech newsflash the morning after elon musk issues ultimatum to remaining twitter employees 
618	 spacex employees say they were fired for speaking up about elonmusk assetmanagement hedgefund fixedincome 
619	clinton linked dark money group targets twitter advertisers pelosi dethroned and more top headlines 
620	elon musk emails staff mandatory pledge says twitter will be extremely hardcore moving forward 
621	 tesla news past h discover more full article trading news 
622	elon musk has someone in mind to run tesla in the future via seekingalpha news seekingalpha
623	 crypto news elon musk questions ftx meltdown coverage 
624	elon musk pulls out of bn twitter takeover read more news covid india 
625	elon musk pulls out of bn twitter takeover read more news covid india 
626	elon musk tesla compensation trial turns to financial experts via wsj news wsj
627	 tech newsflash elon musk tesla payout has billion hand in whether or not he remains the world ric 
628	elon musk said yesterday he expected to reduce his time at twitter and eventually find new leader to run the soci 
629	twitter seemingly working on end to end encryption for direct messages elon musk teases confirmation 
630	elon musk fans made monument to their idol for thousand dollars worldnews news ordonews ordo
631	elon musk has warned twitter could face bankruptcy here why read more news 
632	elon musk has warned twitter could face bankruptcy here why read more news 
633	advertisers boycott twitter as elon musk accuses campaign groups of censoring free speech read more 
634	advertisers boycott twitter as elon musk accuses campaign groups of censoring free speech read more 
635	elon musk is considering stepping down as ceo news tesla 
636	primarily but also the likes of signal news twitter infosec privacy encryption 
637	 confirms that he doesn want to be the ceo of more details 
638	twitter blue relaunch date confirmed by elon musk technoxian twitter elonmusk 
639	 metaverse news and opinion usa repost trending trendingnow writerslift 
640	 here why vain tech moguls including elon musk may think the knives out sequel is ab 
641	no matter what the reason elon musk is in the news daily be it acquiring twitter or dismantling the hyperloop 
642	even as twitter said the sought after blue check subscription service will be relaunched on november billionair 
643	 news via nyt by kate conger elon musk gives twitter employees deadline to stay or leave 
644	 elon musk gives twitter employees deadline to stay or leave via trending news
645	what do you think ny times take on elon musk gives twitter employees deadline to stay or leave is 
646	jimmy fallon asks elon musk to fix ripjimmyfallon hashtag news
647	elon musk is usa rakhi sawant wants to grab attention and be in the news all the time elonmusk twitter news
648	the billionaire first two weeks as twitter owner has been marked by rapid change and chaos malaysianow 
649	elon musk names dogecoin as one of three cryptos with good future discuss on cryptopanic 
650	jimmy fallon is asking elon musk to take down ripjimmyfallon news entertainment 
651	tesla loses m as elon musk bitcoin bet sours read more news covid india 
652	tesla loses m as elon musk bitcoin bet sours read more news covid india 
653	 th november tech news reviews on bbc berkshire via fevzi turkalp 
654	elon musk finally makes up his mind on twitter blue you ll be an official celeb or company if enough verified pe 
655	 news electricvehicles elon musk admits he made decisions at tesla without board approval 
656	musk floated possibility of having successor at tesla via wsj news wsj
657	 people have no idea how fast twitter will evolve elonmusk elonmusknews tesla 
658	elon musk claps back after jimmy fallon asks him to stop twitter users from joking about his death 
659	jimmy fallon begs elon musk to take down ripjimmyfallon news
660	elon musk discloses plans to find new leader for twitter news breakingnews
661	 metaverse news and opinion usa repost trending trendingnow writerslift share the shock of twitter owner 
662	 musk discussed potential successor as tesla ceo james murdoch says news information 
663	the wall street journal elon musk floats possibility of his successor at tesla says he plans to eventually find 
664	elon musk floated possibility of having successor at tesla board member says via wsj news wsj
665	elon musk gives twitter employees an ultimatum stay or go by tomorrow gt technews technology news
666	elon musk will find someone else to run twitter twitter community news 
667	 news elon musk has successor in mind to be tesla ceo 
668	doja cat twitter name stuck gets elon musk help news dojacat 
669	 in the news at pm elon musk reveals twitter ceo plan
670	elon musk hints he won be twitter permanent chief via seekingalpha news seekingalpha
671	elon musk says in court that he doesn want to be ceo of any company and tries to walk back sec insults 
672	musk tells twitter staff to work long hours at high intensity or leave via wsj news wsj
673	according to copy of late night internal email received by the billionaire and acquired by cnn twitter new 
674	in court wednesday elon musk said he wants someone else to run twitter twitter elon musk technology news 
675	elon musk says he doesn want to be ceo of any company and tries to walk back sec insults via cnbc news cnbc
676	tesla sued by former workers over elon musk staff cuts read more news covid 
677	tesla sued by former workers over elon musk staff cuts read more news covid 
678	key words elon musk tells twitter employees to put in long hours at high intensity or take severance 
679	elon musk says he doesn want to be ceo of any company and tries to walk back sec insults via cnbc news cnbc
680	elon musk said on wednesday he expects to reduce his time at twitter and find someone else to eventually run the so 
681	cnn jimmy fallon is asking elon musk to take down ripjimmy fallon entertainment news 
682	elon musk is perhaps the most potent money manager who knows how social media marketing in usa tesla marketing st 
683	elon musk says twitter blue verification is coming back november th trending news 
684	elon musk disaster artist by news via 
685	 elon musk gives twitter employees deadline to stay or leave by by kate conger via nyt new york times 
686	 in the news at am elon musk says he had little say in his tesla pay
687	elon musk demands twitter staff commit to long hours or leave news
688	new article alert can elon musk twitter still be safe space for the lgbtq community click the link to find 
689	elon musk tells twitter staff to work long hours or leave hit radio charlie 
690	 gt what does an inventor the likes of elon musk have to say about society ills plenty read freeman explains 
691	elon musk idea for paid twitter verification is completely flawed eu competition chief says 
692	elon musk demands twitter staff commit to long hours or leave read the email via cnbc news cnbc
693	spacex fires staff over letter criticising elon musk read more news covid india 
694	spacex fires staff over letter criticising elon musk read more news covid india 
695	elon musk fires more complaining wokester geniuses from twitter socialmedia news breakingnews
696	elon musk fires more complaining wokester geniuses from twitter america news trump 
697	 tech newsflash blind users from other tech giants are telling twitter employees to just quit over elon mu 
698	 tech newsflash after elon musk fired twitter staff for criticizing him some remaining employees are hurrie 
699	as write this article twitter is buzzing over email send by chief twit aka elon musk and m puzzled why twitt 
700	elon musk demands twitter staff commit to long hours or leave read the email via cnbc news cnbc
701	elon musk says he will remove the twitter for iphone twitter for android tab news 
702	 elon musk demands twitter staff commit to long hours or leave news information 
703	elon musk is taking twitter private all you need to know read more at elonmusk twitter 
704	elon musk twitter takeover elon musk twitter takeover is now official his journey of writing billion cheq 
705	 latestnews elon musk announces another change to twitter says device indicator to be removed elonmusk 
706	metro elon musk ultimatum to twitter staff says commit to hardcore work or leave news tech technology 
707	want to archive twitter good luck with that news technology trends future innovation technews
708	aka reaches out to elon musk again amid energy crisis sa hip hop star aka has reached out to famous billionaire el 
709	analysis elon musk twitter faces its titanic moment as executives and advertisers flee while trolls run rampan 
710	analysis elon musk twitter faces its titanic moment as executives and advertisers flee while trolls run rampan 
711	musk to take stand in trial over his tesla compensation package via wsj news wsj
712	elon musk demands twitter employees commit to extremely hardcore culture or leave 
713	 blue paid verification is returning very soon after being suspended less than week ago twitter 
714	elon musk sued by twitter investors for driving down takeover price read more 
715	elon musk sued by twitter investors for driving down takeover price read more 
716	in an email to twitter staff elon musk gives an ultimatum commit to new hardcore twitter by pm et on thursda 
717	twitter chaos spills into public view as musk clashes with and fires employees on the platform cnn business news
718	 metaverse news and opinion usa repost trending trendingnow writerslift writingcommunity the shock of tw 
719	 welcoming back ligma and johnson says elon musk as he rehires twitter employees who never worked there 
720	check out this article elon tesla news cryptonews cryptocurrencies คร ปโต
721	twitter employee calls out elon musk on twitter it doesn end well for the employee news
722	a twitter engineer who was recently fired from the company urged the remaining employees to disobey elon musk 
723	 news via nyt by kate conger ryan mac and mike isaac elon musk fires twitter employees who criticized him 
724	 elon musk fires twitter employees who criticized him via trending news
725	spacex ceo elon musk said bloomberg report claiming that the rocket launch and satellite company is in talks to 
726	twitter layoffs elon musk hires pranksters ligma johnson says firing them was his biggest mistake stay tuned to 
727	elon musk has said that twitter blue tick subscription service will be relaunched on november technology 
728	benzinga points out that elon musk tortures himself to the next level and asks could you handle his workload 
729	twitter blue tick verification plan to be relaunched on nov elon musk news dailyhunt 
730	elon musk tells twitter staff bankruptcy not out of the question will doge be affected 
731	 twitter will relaunch sign ups for its twitter blue service on november owner elon musk said on tuesday anyo 
732	twitter blue ticks to cost month says elon musk read more news covid 
733	twitter blue ticks to cost month says elon musk read more news covid 
734	tesla projections take center stage on day two of elon musk compensation trial via wsj news wsj
735	 news iphone twitter elon musk teases the end of twitter for iphone labels on tweets 
736	 much appreciated spacex will not let nasa down elonmusk 
737	 elon musk fires twitter employees who criticized him by by kate conger ryan mac and mike isaac via nyt new york 
738	 in the news at pm elon musk fires twitter employees who criticized him
739	elon musk fires entire twitter board of directors to take sole control read more 
740	elon musk fires entire twitter board of directors to take sole control read more 
741	john oliver says it funny watching elon musk destroy twitter billion being set on fire news johnoliver
742	 breaking news elon musk brings back ligma johnson to breakingnews news technews twitterposts 
743	three twitter employees fired for public spat with elon musk news stocks stockmarketnews
744	 bitcoin was up in hours trading for the global crypto ownership rate is estimated to be aroun 
745	twitter elon musk warned he is not above the law as twitter takeover descends into chaos read more 
746	twitter elon musk warned he is not above the law as twitter takeover descends into chaos read more 
747	elon musk fires twitter engineer via tweet socialmedia news breakingnews
748	if you re thinking about quitting elon musk twitter here how to use alternative mastodon via cnbc news cnbc
749	it might be good idea to review and change your two factor authentication options for twitter elon musk 
750	sacked twitter executives at risk of being denied m payout by elon musk read more 
751	sacked twitter executives at risk of being denied m payout by elon musk read more 
752	 metaverse news and opinion usa repost trending trendingnow writerslift the shock of twitter owner elon 
753	 what does an inventor the likes of elon musk have to say about society ills plenty read freeman explains joh 
754	laid off twitter employees claim in lawsuit that the company persuaded them not to look for new jobs in the run 
755	elon musk says he fired the engineer who corrected him on twitter via news twitter elonmusk news
756	dogecoin future could follow this bullish trajectory to doge price thanks to elon musk 
757	charlie munger calls the success of elon musk tesla minor miracle in the car business via cnbc news cnbc
758	charlie munger calls the success of elon musk tesla minor miracle in the car business 
759	 at least now we re able to write our opinions thankyou elon musk free vote twitter 
760	 tech newsflash elon musk fires twitter engineers for criticizing him technology bot news
761	 tech newsflash elon musk will reportedly keep awarding twitter employees stock and options even though th 
762	 he set off my bs detector elon musk passed on having sam bankman fried as investor in twitter 
763	 he set off my bs detector elon musk passed on having sam bankman fried as investor in twitter 
764	meet the members of elon musk inner circle said to be helping him fix twitter news 
765	charlie munger calls the success of elon musk tesla minor miracle in the car business via cnbc news cnbc
766	tesla chair testifies in elon musk compensation trial in delaware via wsj news wsj
767	charlie munger calls the success of elon musk tesla minor miracle in the car business 
768	wow twitter was paying per employee per meal where are all the liberals who wanted elon musk to end world 
769	 the daily show nails trainwreck of elon musk twitter in glorious seconds desi lydic has the impossible job 
770	elon musk tesla pay package heads to court news topstories bbc
771	twitter employees fired by tweet others can get stock ads high risk says biggest agency number of twitter emp 
772	elon musk spacex rockets linked to death of endangered birds read more news 
773	elon musk spacex rockets linked to death of endangered birds read more news 
774	charlie munger calls the success of elon musk tesla minor miracle in the car business via cnbc news cnbc
775	charlie munger calls the success of elon musk tesla minor miracle in the car business 
776	elon musk latest email to twitter employees addresses working late read more 
777	elon musk latest email to twitter employees addresses working late read more 
778	elon musk fires disgruntled employee by tweet socialmedia news breakingnews
779	elon musk fires disgruntled employee by tweet america news trump infowars freespeech politics
780	metro elon musk fires twitter employee on twitter after disagreeing about twitter news tech twitter 
781	eric frohnhoefer an engineer who was fired from twitter after engaging in public disagreement with elon musk sh 
782	is elon musk twitter about to fall out of the gdpr one stop shop breaking news
783	elon musk comments on bitcoin price collapse says it will make it btc ethereum news
784	tesla uses apple play book november th tesla ceo elon musk definitely seems to be following playbook th 
785	everything elon musk did on his first day at twitter read more news covid india 
786	everything elon musk did on his first day at twitter read more news covid india 
787	elon musk revives hopes for k tesla november th tesla is working on new vehicle platform that coul 
788	mps demand elon musk comes to london to discuss twitter takeover read more news 
789	mps demand elon musk comes to london to discuss twitter takeover read more news 
790	elon musk plans to end twitter for iphone and android device labels over the years numerous celebrities have be 
791	 tech newsflash elon musk fires twitter engineer for arguing with him publicly technology bot news
792	 tech newsflash elon musk plans to end twitter for iphone and android device labels technology bot news
793	 tech newsflash twitter trust and safety team sent elon musk page list of the risks with his paid veri 
794	elon musk spoke about the future news worldnews ordonews ordo
795	 technology news elon musk new brain interface technology psychology today news 
796	elon musk plans to end twitter for iphone and android device labels over the years numerous celebrities have be 
797	stephen colbert taunts elon musk over circle of jerk attempt to save himself the late show host mocks the twit 
798	elon musk fires twitter employee in tweet twitter news 
799	list of companies co founded by elon musk read the full article on visit email info 
800	twitter new owner elon musk said that the social media platform will stop adding labels that identify what kind 
801	 elon musk plans to end twitter for iphone and android device labels technology technews tech news 
802	 technology news elon musk new brain interface technology psychology today news 
803	democrat senator demands answer from elon musk news
804	 metaverse news and opinion usa the shock of twitter owner elon musk prophetically reporting twitter may not 
805	 metaverse news and opinion usa trending trendingnow the shock of twitter owner elon musk prophetically 
806	 musk publicly punishes twitter engineers who call him out online news information 
807	read the m email elon musk sent to staff his first announcing the end of remote working at twitter 
