	text
0	elon musk loses billion in net worth as tesla stock prices plummet news
1	elon musk wasn twitter supposed to die by now or something socialmedia news breakingnews
2	investors may see tesla as house of cards after watching elon musk sow chaos at twitter cnbc analyst 
3	severely increased post musk walking into that building one of the researchers behind the work says the ful 
4	 news elon musk tweets namaste to indians twitter in splits read more 
5	 tech newsflash voices worked at twitter for seven years this is what want you to know 
6	 tech newsflash how elon musk twitter takeover is ruining his own myth and tesla stock 
7	elon musk twitter risks big fines from us regulators news technology trends future innovation technews
8	huge news twitter ceo elonmusk declares purging the platform of child sexual exploitation priority 
9	 how to get started on hive social news information business travel food sports 
10	elon musk names korea among top candidates for ev investment yoon office stockmarket stocks finance news
11	tesla ceo elon musk has said that south korea is among its top candidate locations to build an electric vehicles 
12	elon musk considers south korea for next tesla gigafactory more info here tesla 
13	 elon musk defends cop who killed unarmed black man in ferguson news information 
14	 tech newsflash trent reznor says he moving on from twitter and elon musk is taking it personally 
15	 tech newsflash elon musk clarifies that he makes final decisions on twitter posts technology bot news
16	 tech newsflash falling tesla stocks have taken billion bite out of elon musk fortune 
17	eu to elon musk twitter we will have control we will have access people will no longer be able to say just 
18	eu to elon musk twitter we will have control we will have access people will no longer be able to say just 
19	musk twitter takeover triggers partisan clash via wsj news wsj
20	elon musk loses billion wealth in year worst hit among world richest 
21	elon musk temporarily closes twitter offices amidst mass resignation elonmask news 
22	 adult performers trump supporters and parodies who is paying for twitter by by stuart thompson via nyt new 
23	congress should investigate elon musk business ties with china politicslive news 
24	 gamification news elon musk has said he about context on tweets so here context for these shirt 
25	 follow for daily tldr news news tldr tldrnews twitter elonmusk musk musktwitter elonmusktwitter 
26	trump clearly has some kind of psychodrama going on with musk culture civilrights 
27	elon musk loses billion as tesla share price continues to sink news
28	elon musk to address twitter child sexual exploitation problem news
29	 elon musk blamed the media west in spreading brazen lies about missiles that fell in poland which threatened 
30	elon musk is reportedly considering cutting more of twitter workforce 
31	in an all hands meeting with employees informed that the company would resume active recruitmen 
32	 news via nyt by mike isaac and ryan mac as elon musk cuts costs at twitter some bills are going unpaid 
33	elon has announced now that the festering wound that was twitter is over it purge they ll now be hiring again 
34	read now tips insider news elon musk has upended twitter business here how he could fix it 
35	 as elon musk cuts costs at twitter some bills are going unpaid via trending news
36	nytimes what elon musk is doing to twitter is what he did at tesla and spacex is not an op ed and actually 
37	secret text sam bankman fried elon musk two weeks after clinching deal for b elonmusk texted sbf invit 
38	elon musk ceo of tesla spacex and twitter has seen his wealth dwindle by over billion this tesla news 
39	elon musk cheers woke journalist migration from twitter news
40	elon musk has himself to blame for twitter advertising woes civil rights groups say via cnbc news cnbc
41	 elon musk tries to blame activists for his twitter moderation council lie news 
42	supreme court allows handover of trump tax returns to congress live the independent news 
43	breaking bankman fried was an investor in musk twitter deal his contribution amounted to million news 
44	don like musk work for us tech firms woo ex twitter staff news tech technology technews 
45	elon musk reinstates trump twitter account news breaking_news business finance markets nyc
46	 you ve worked for an erratic and unpredictable boss like elon musk tell us what happened 
47	elon musk twitter will delay reintroducing blue check verification business news 
48	huge thanks to journalist for interviewing me for her big post about twitter had fun talking 
49	when breaking news is tweet away 
50	 news twitter elon musk wants twitter dms to be more secure interested in video and voice chat 
51	supreme court allows handover of trump tax returns to congress live the independent news 
52	 dropshipkingz vibetv news man gets elon musk name tatted on his face to get the billionaire to invite him 
53	 news man gets elon musk name tatted on his face to get the billionaire to invite him on his next space journey 
54	 tech newsflash naacp adl call for twitter ad boycott after musk reinstates trump technology bot news
55	 tech newsflash if elon musk really doesn want twitter to look right wing he doing terrible job 
56	 tech newsflash don like musk work for us tech firms woo ex twitter staff the guardian 
57	 tech newsflash crypto nerds built elon musk statue of his head on goat technology bot news
58	 tech newsflash the culture is decimated elon musk tyrannical management slammed on anonymous employe 
59	twitter paid verification rollout on hold elon musk explains why details please fol 
60	twitter may finally have good vision for the future elon musk tenure so far at twitter has been something ve 
61	elon musk has upended twitter business here how he could fix it více zde zpráva 
62	 androidcentral elon musk wants to give twitter dms an upgrade android tech tech 
63	elon musk is reinstating banned twitter accounts here who back entrepreneur startup news
64	how twitter became one of the world preferred platforms for sharing ideas gt technews technology news
65	elon musk is reinstating banned twitter accounts here who back entrepreneur startup news
66	elon musk takes hit tesla stock loses billion in value triple disney total market cap 
67	the us government still isn sure about elon musk twitter like 
68	 tech newsflash elon musk wealth drops by us billion in one day technology bot news
69	 tech newsflash elon musk puts an end to some twitter perks limits expenses due to company challenging 
70	elon musk insta killed his latest twitter verification scheme bluecheck business 
71	elon musk twitter reinstates anti trans activists on same weekend as club attacked news 
72	 as elon musk cuts costs at twitter some bills are going unpaid by by mike isaac and ryan mac via nyt new york ti 
73	former iphone jailbreaker and self driving car developer is fixing twitter search elon musk has hired noted iphone 
74	elon musk claims twitter layoffs are done and company is hiring coders socialmedia news breakingnews
75	rocker jack white deletes twitter account calls elon musk absolutely disgusting socialmedia news breakingnews
76	elon musk insta killed his latest twitter verification scheme bluecheck business 
77	 in the news at pm as elon musk cuts costs at twitter some bills are going unpaid
78	since elon musk became ceo many twitter employees have resigned but this hasn stopped elon from laying off work 
79	elon musk twitter blue will not be available again until identity theft issues are resolved 
80	yeah it freespeech for select racist few elon musk free speech twitter is still censoring ddosecrets 
81	twitter adds million daily active users in week elon musk says socialmedia news breakingnews
82	 washington examiner the prodigal network cbs news returns to twitter less than two days after pause to pro 
83	read elon musk friday emails to twitter engineers asking them to come to the office read here 
84	 tech newsflash twitter is being destroyed by one of its worst main characters the ringer 
85	 tech newsflash tesla stock price down since elon musk offered to buy twitter technology bot news
86	 tesla stock on track for its worst year ever as elon musk ev giant faces big headwinds 
87	 news amazon elonmusk shib shibainu shiba inu direct partnership with amazon and elon musk newest developme 
88	elon musk is doing better job at draining the swamp in less than month what trump couldn do in years elon 
89	tired of long news articles read summary for the latest news article in min or less tech technology 
90	according to new report elon musk has directed direct messages dm to be end to end encrypted similarly they 
91	after tesla and spacex top manager elon musk bought twitter big changes started in the company news 
92	elon musk reinstates trump twitter account elonmusk trump news newsgenics healtharcade 
93	the only constant at elon musk twitter is chaos news technology trends future innovation technews
94	 tech newsflash world richest man elon musk wealth has taken billion hit in thanks to plumm 
95	 tech newsflash elon musk says he wants twitter to have video chat voice calls and encrypted dms 
96	elon musk cheers woke journalist migration from twitter judgy hall monitors stay on other platforms 
97	elon musk has been losing rs crore everyday in due to twitter troubles follow for more 
98	elon musk says twitter is holding off restarting paid verification over impersonation concerns news
99	elon musk talks about fsd beta upcoming wide release more info here tesla teslanews 
100	elon musk greets indian followers in desi way his namaste tweet goes viral with meme replies news dailyhunt 
101	riedy takes over from robin wheeler who was fired by elon musk for refusing to lay off more members of his own staf 
102	musk antagonist george hotz hired to fix twitter search he got weeks news 
103	 tech newsflash world richest man elon musk wealth has taken billion hit in thanks to plumm 
104	musk antagonist george hotz hired to fix twitter search he got weeks science tech 
105	elon musk reasons to block alex jones return to twitter have nothing to do with the reason he was banned 
106	elon musk reasons to block alex jones return to twitter have nothing to do with the reason he was banned 
107	elon musk will have final say over twitter content moderation council tmz news celebrity 
108	elon musk faces backlash over new policy on mean tweets news
109	jeff bezos elon musk and ken griffin are sounding the alarm on us recession here are dire economic warnings 
110	twitter looks far from dead as usage apparently skyrockets post elon musk buyout notebookcheck news tech
111	twitter africa employees accuse elon musk of discrimination over severance terms více zde 
112	elon musk says twitter blue relaunch delayed may use different color checks for organizations cnbc cnbc news 
113	twitter is done with layoffs may set up engineering team in india elon musk news dailyhunt 
114	elon musk holds of twitter blue relaunch twitterblue elonmusktwitter elonmusk 
115	relaunch of blue is on hold until there is high confidence of stopping impersonation says elon musk 
116	 news nineinchnails trentreznor trent reznor quits twitter gets called crybaby by elon musk 
117	 news jackwhite jack white slams elon musk over donald trump twitter return 
118	trump news live manhattan da resumes stormy daniels hush money probe as elon musk unbans conservatives the ind 
119	 news via nyt by ryan mac and jack ewing what elon musk is doing to twitter is what he did at tesla and spacex 
120	elon musk wealth loss exceeds billion for first time news dailyhunt 
121	 more woes for twitter as its france head leaves news information business travel 
122	 elon musk cuts more twitter jobs news information business travel food sports 
123	elon musk says twitter is holding off restarting paid verification over impersonation concerns více zde 
124	elon musk says twitter blue relaunch delayed may use different color checks for organizations via cnbc news cnbc
125	twitter is making dms encrypted and adding video voice chat per elon musk science tech 
126	the wall street journal elon musk continues twitter job cuts laying off sales employees news stocks
127	twitter before elon vs after musk besides sex gender discrimination what else do you see elonmusk 
128	twitter won restart paid verification until significant impersonations stop elon musk tells employees 
129	jack are you there elon musk is destroying twitter and you square elonmusk news trump biden bitcoin ftx 
130	are you victim of elon musk and crypto fraudsters join the world best traders elonmusk news trump biden 
131	white stripes rocker jack white rips elon musk restored fascist trump twitter account to avoid paying fair sh 
132	elon musk says twitter is done with layoffs and ready to hire again science tech culture 
133	 news verge reports elon musk told twitter employees there will be no more layoffs 
134	elon musk taunts donald trump with sexual meme to return to twitter news donald elon meme musk return sexual 
135	 shalom kanye west returns to elon musk twitter news feedly
136	why elon musk made big mistake here socialmedia news breakingnews
137	the benny show november elon musk liberates twitter trump doubles joe biden followers as med 
138	elon musk gets weird in baiting trump into tweeting again news
139	elon musk twitter reinstates rep marjorie taylor greene associated press elon musk twitter has reinstated th 
140	twitter frances head quits company amid elon musk layoffs its over national francenews worldnews news 
141	gm suspends advertising on twitter to evaluate its direction under elon musk 
142	 in the news at pm what elon musk is doing to twitter is what he did at tesla and spacex
143	opinion as one media scholar told me just after trump was banned from in of trump tweets 
144	president trump snubs twitter after musk announces account reactivation in poll posted to twitter on november 
145	the margin what does free speech actually mean twitter was never censoring speech despite what elon musk and 
146	key words elon musk has no mercy for alex jones and won reinstate his twitter account news stocks
147	elon musk is laying off even more twitter workers science tech culture reviews art 
148	alex jones responds to elon musk declaration of war apparent threat socialmedia news breakingnews
149	alex jones responds to elon musk declaration of war apparent threat america news trump 
150	elon musk fights child sex abuse after twitter speech police refused for years socialmedia news breakingnews
151	 elon musk is laying off even more twitter workers news information business travel 
152	internet rallies behind alex jones return to twitter after elon musk declares no mercy 
153	internet rallies behind alex jones return to twitter after elon musk declares no mercy 
154	elon musk is laying off even more twitter workers news technology trends future innovation technews
155	twitter won restore alex jones account elon musk says news science tech 
156	 no mercy elon musk states alex jones will never be allowed back to twitter over sandy hook comments 
157	 tech newsflash icymi the liberal media meltdown over musk twitter hit fever pitch this weekend 
158	 tech newsflash former twitter manager mocked elon musk leadership in song about working to 
159	the margin twitter alternatives like mastodon and hive social in case the social network shuts down on elon mu 
160	twitter boss elon musk keeps conspiracy theorist alex jones off platform news topstories bbc
161	elon musk fan boys are making lots of money today on crypto reddit scam roflmao elonmusk twitterstillopen 
162	twitter africa employees accuse elon musk of discrimination over severance terms via 
163	 austin usa news maga texas 
164	report elon musk isn done slashing twitter workforce socialmedia news breakingnews
165	new research shows of leaders regret their first moves as ceo will elon musk federal state news
166	elon musk says alex jones won be allowed back on twitter news alex allowed elon jones musk twitter wont 
167	twitter africa employees accuse elon musk of discrimination over severance terms více zde 
168	us govt to probe musk twitter as he plans more layoffs alwaleed_talal china chrismurphyct cspan elonmusk 
169	 news jackwhite jack white slams elon musk over donald trump twitter return 
170	 tech newsflash my firstborn child died in my arms elon musk reveals why twitter won lift alex jones ba 
171	 tech newsflash elon musk is running twitter like failing newspaper business technology bot news
172	 tech newsflash fired twitter engineer said he would have come up with way cleverer and more devastating 
173	 tech newsflash elon musk referenced the bible and said he won allow sandy hook conspiracy theorist alex 
174	 tech newsflash elon musk went on firing frenzy at twitter now he paying for it robert reich 
175	 elon musk keeps twitter ban for sandy hook conspiracy theorist alex jones news 
176	is the twitter france president stepping down result of elon musk influence finance news economy market 
177	 the accounts of kanye west now ye and andrew tate people who were shut down for spreadin 
178	the twitter news feed has gone to shit thank you elon musk the self proclaimed defender of freedom of speech and 
179	elon musk sold worth of tsla shares besstocksnews news 
180	twitter boss elon musk keeps conspiracy theorist alex jones off platform news feedly
181	are twitter days numbered after elon musk chaotic takeover of the company gt technews technology news
182	read elon musk friday emails to twitter engineers asking them to come to the office read more 
183	twitter boss elon musk keeps conspiracy theorist alex jones off platform hit radio charlie 
184	trump news live twitter silence from trump after reinstatement by elon musk as last post goes viral the indepe 
185	elon musk backers cheer him on even if they aren sure what he doing to twitter gt technews technology news
186	elon musk reinstates donald trump twitter account news twitter latestnews twitter
187	 tech newsflash this is the worst time for donald trump to return to twitter technology bot news
188	 tech newsflash the only thing elon musk understands about twitter is how to kill it technology bot news
189	tesla and spacex ceo elon musk eventful twitter process continues finally twitter news turkey turkeynews 
190	weekend news top news over weekend bob iger comes back as disney ceo bbc ignored open ceremony of world cup elo 
191	elon musk plans to create app ordo ordonews news worldnews
192	elon musk the winter of the market is long but bitcoin will succeed adon adonis_network adonis_exchange 
193	trump news live twitter silence from trump after reinstatement by elon musk as last post goes viral the indepe 
194	elon musk says free employee lunches at twitter hq were costing more than per meal because almost no one was 
195	pranksters fool some media members after elon musk twitter takeover 
196	elon musk lifts ban on trump twitter account news video inside 
197	trump news live twitter silence from trump after reinstatement by elon musk as last post goes viral the indepe 
198	 reinstate former president trump trump return on twitter after elon musk poll 
199	after elon musk ultimatum twitter employees start exiting hahalolo news switter
200	elon musk jack dorsey address suggestions to allow less anonymity on twitter news marketnews bitcoins
201	 donald trump account restored by elon musk after the poll twitter elonmusk donaldtrump news president 
202	 product review kanye west returns to twitter after elon musk brings trump back news 
203	musk reinstates trump twitter account after online poll via wsj news wsj
204	 product review kanye west returns to twitter after elon musk brings trump back news 
205	elon musk restores donald trump twitter account hightech technology ai news 
206	elon musk pokes fun at cbs short lived twitter hiatus after network resumes tweeting less than hours later 
207	breaking news around the world krcotter news elonmusk news topnews breakingnews
208	celebrities cope and seethe after elon musk restores trump twitter account tragic day for america 
209	some idiots are blocking elon musk believing it makes difference but the real difference has been to get rich 
210	kanye west returns to twitter news
211	 world cup qatar opening ceremony elonmusk elonmusknews 
212	 tech newsflash elon musk unbans kanye west donald trump andrew tate on twitter technology bot news
213	kanye west returns to twitter after his account is unblocked following elon musk takeover celebritynews news
214	 gt what does an inventor the likes of elon musk have to say about society ills plenty read freeman explains 
215	breaking news around the world krcotter news how true 
216	trump news live twitter silence from trump after reinstatement by elon musk as last post goes viral the indepe 
217	trump terrifically stupid return to twitter news trump elonmusk stupidrichpeople stupid
218	twitter must shutdown can elon musk save twitter from bankruptcy check our new video elonmusk twitter 
219	elon musk about racism elonmusk racist racism blm fifaworldcup news 
220	cbs news suspends all twitter activity confirming our most recent data concerning elon musk insanity twitter 
221	trump news live twitter silence from trump after reinstatement by elon musk as last post goes viral the indepe 
222	elon musk lifts donald trump twitter ban after online poll ht heritagetimes news 
223	musk reinstates trump twitter account after online poll via wsj news wsj
224	elon musk has begun his takeover of twitter like comment ff 
225	musk reinstates trump twitter account after online poll via wsj news wsj
226	cbs news suspends twitter activity amid uncertainty of elon musk leade via 
227	elon musk says he will reinstate twitter account of former president donald trump after online poll 
228	elon musk restores donald trump twitter account trump elonmusk news
229	elon musk reinstates donald trump twitter account following poll news elonmusk donaldtrump trump twitter
230	trump news live twitter silence from trump after reinstatement by elon musk as last post goes viral the indepe 
231	elon musk downscaled twitter faces soccer world cup test via wsj news wsj
232	 tech newsflash twitter fact checking project how elon musk community notes feature works 
233	 tech newsflash elon musk reinstated donald trump on twitter now the real drama begins 
234	elon musk removes ban from twitter accounts news elonmusk details here 
235	elon musk removes ban from twitter accounts news elonmusk details here 
236	elon musk restores trump after twitter vote but not alex jones despite calls for reinstatement 
237	elon musk restores trump after twitter vote but not alex jones despite calls for reinstatement 
238	 truth social has been very very powerful donald trump says he won return to elon musk twitter 
239	cnn tosca musk elon sister has business venture of her own and it all about romance and female sexualit 
240	trump shuns twitter when elon musk announces the resurrection of his account trump twitter elonmusk potus meme 
241	monsters critics donald trump is back on twitter following elon musk takeover crime 
242	twitter was already in disarray trump return will only make it more chaotic více zde 
243	opinion joe biden and elon musk at opposite ends of leadership equation více zde zpráva 
244	tosca musk elon sister has business venture of her own and it all about romance and female sexuality více 
245	 tech newsflash elon musk reinstates former president donald trump twitter account technology bot news
246	 tech newsflash the power players activists and pioneers shaping the future of business from sustaina 
247	 follow for daily tldr news news tldr tldrnews tech socialmedia twitter elonmusk donaldtrump 
248	 trump is back elon musk brings trump back impact on india and the world trump 
249	elon musk restores donald trump twitter account socialmedia news breakingnews
250	elon musk restores donald trump twitter account america news trump infowars freespeech politics
251	a twitter executive who left the company when elon musk took over has returned to lead its trust and safety team 
252	elon musk embraces twitter radical fact checking experiment news technology trends 
253	it is about time that trump is reinstated to twitter so elon must did poll and over million responded with 
254	musk restores trump twitter account after online poll socialmedia twitter elonmusk facebook truthsocial 
255	elon musk restores donald trump twitter account technology news capital tv news tech technology technews 
256	 news elon musk restores donald trump twitter account read more 
257	 news elon musk invites people to watch the first world cup match on twitter 
258	how does elon musk fast track productivity november th elon musk unique way of running companies has 
259	 tech newsflash elon musk trump poll believed to be clever bot trap technology bot news
260	 tech newsflash elon musk twitter poll suggests donald trump will be reinstated on the platform 
261	 tech newsflash in dublin it elon musk versus the housing market technology bot news
262	 tech newsflash beware self made genius entrepreneurs promising the earth just look at elon musk kenan 
263	breaking elon musk reinstates donald trump twitter account elonmusk trump twitter trumptwitter uspolitics 
264	elon musk restores donald trump twitter account after poll via 
265	the twitter account of former us president donald trump was back up again after the social media company new owne 
266	elon musk on twitter on november give former us president trump his account back account trump 
267	how mastodon favorite twitter alternative works via news breaking socialmedia
268	most up to date information donald trump will be reinstated on twitter confirms elon musk news shorts reels 
