	text
808	 can give predictions of what shall be trending elon_musk twitterblue news tuesdaymotivaton 
809	 focus on elon musk elon musk is divisive figure to some he is st century genius and to others just 
810	doja cat asks elon musk for help entertainment ktbs com news dojacat 
811	eric frohnhoefer an engineer who was fired from twitter after engaging in public disagreement with elon musk sh 
812	elon musk buys twitter for bn read more news covid india instagram love 
813	elon musk buys twitter for bn read more news covid india instagram love 
814	elon musk said that he has fired ericfrohnhoefer twitter employee who had publicly corrected him on the micro 
