	text
269	 cbsnews is halting its activity on twitter over elon musk turbulent and potentially devastating moves following 
270	 year old boy shot dead in iranian regimes brutal crackdown yearned to be like elon musk 
271	trump twitter account restored by musk via news trending trendingnews
272	elon musk lets donald trump back on twitter news omnihanded entertainmet news news 
273	elon musk lets donald trump back on twitter news omnihanded entertainmet news news 
274	elon musk asks twitter users to vote on reinstatement of donald trump account see the poll news video inside 
275	elon musk restores donald trump twitter account via news trending trendingnews
276	spacex employees fired for writing letter blasting elon musk behavior news
277	 news via nyt by ryan mac and kellen browning elon musk reinstates trump twitter account 
278	 in the news at nov elon musk reinstates trump twitter account
279	breaking twitter news elon musk reinstated former president trump twitter news texas 
280	will donald trump tweet again elon musk reinstates donald trump on twitter news
281	 elon musk reinstates trump twitter account via trending news
282	 in the news at nov elon musk restores donald trump twitter account
283	 product review elon musk lets trump back onto twitter news 
284	elon musk reinstates donald trump twitter account news 
285	elon musk reinstates donald trump twitter account news 
286	donald trump has been reinstated on twitter by elon musk topstories news popculture
287	donald trump reacts after elon musk reinstates his twitter account ending lifetime ban news topstories worldnews
288	elon musk reinstates trump twitter account news tech technology technews 
289	mr musk you and your company twitter please make me famous twitteroff elon 
290	donald trump twitter account reinstated by elon musk tmz news celebrity 
291	elon musk restores donald trump twitter account news tech technology technews 
292	elon musk restores donald trump twitter account news topstories breakingnews
293	elon musk to reinstate donald trump on twitter but ex president says he won return news topstories popculture
294	elon musk reinstates donald trump twitter account after holding poll account has lost m followers 
295	elon musk re instates donald trump twitter account after public poll donaldtrump trumpisback elonmusk 
296	former us president donald trump twitter account reappeared on sunday after elon musk confirmed to reinstate his 
297	donald trump apparently back on twitter after elon musk poll votes to lift his ban sky news news 
298	elon musk says he will reinstate twitter account of former president donald trump after online poll 
299	musk reinstates trump twitter account after online poll via wsj news wsj
300	trump twitter account restored by musk news topstories abc
301	good riddance lowlife antifa protester among those who lost job in elon musk massive twitter layoffs 
302	elon musk plans to increase the number of twitter layoffs in sales division reports news dailyhunt 
303	new papastanimus video elon musk reinstates trump on twitter viral news papastanimus reaction
304	convicted scammer anna sorokin said elon musk is one of her dream dinner guests because his views are very fluid 
305	 donald trump returns to twitter thanks to elon musk news information business travel 
306	 trump twitter account has been reinstated by elon musk america usa news 
307	 elon musk reinstates donald trump twitter account social media news news 
308	 in the news at pm elon musk reinstates trump twitter account
309	elon musk says he will reinstate twitter account of former president donald trump after online poll 
310	elon musk reinstates donald trump twitter account by news via 
311	twitter reverses permanent ban on donald trump by news via 
312	elon musk reinstates trump twitter account elon trump twitter news follow share 
313	elon musk says he will let trump back onto twitter breaking breakingnews politics usa news newsbreak 
314	musk reinstates trump twitter account after online poll via wsj news wsj
315	elon musk restores donald trump twitter account socialmedia news breakingnews
316	donald trump returns to twitter nearly years after getting banned following elon musk poll 
317	elon musk allows donald trump back on twitter breaking breakingnews politics usa news newsbreak trending 
318	elon musk trump will be reinstated on twitter after poll elon_musk twitter trump elon news will 
319	trump is back on twitter my colleagues nailed elon musk since the beginning twitter news 
320	elon musk allows donald trump back on twitter breaking breakingnews politics usa news newsbreak trending 
321	elon musk restores donald trump twitter account viral news trending donaldtrump 
322	 in the news at pm elon musk restores donald trump twitter account
323	elon musk reinstates trump twitter account news tech technology technews 
324	musk restores trump twitter account after online poll los angeles ap elon musk reinstated donald trump acc 
325	elon musk bought twitter and here everything that happened next news technology 
326	elon musk says he letting donald trump back on twitter news technology trends future innovation technews
327	the us government still isn sure about elon musk twitter technology news
328	will donald trump tweet again musk says trump to be reinstated on twitter breaking breakingnews politics usa 
329	elon musk allows donald trump back on twitter gt technews technology news
330	 culture politics donaldtrump elonmusk news elon musk restores donald trump twitter account after online poll 
331	trump reinstated breaking news trump biden
332	the poll conducted by elon musk the new owner of the social media platform twitter on the return news 
333	elon musk says he will reinstate twitter account of former president donald trump news topstories cnbc
334	elon musk bought twitter now what next science tech culture reviews art media 
335	elon musk says he letting donald trump back on twitter science tech culture reviews 
336	 elon musk says he will reinstate trump on twitter by by ryan mac and kellen browning via nyt new york times 
337	 elon musk after twitter poll news information business travel food sports cricket 
338	 breaking elon musk restores donald trump twitter account following the results of poll on the platform news
339	 elon musk announces the people have spoken trump will be reinstated on twtr news retweet
340	breaking donald trump to be reinstated back on twitter after ban per elon musk stocks news trump newsupdates
341	elon musk unbans former president donald trump twitter account geekriches geekriches 
342	 the us government still isn sure about elon musk twitter news information business 
343	the us government still isn sure about elon musk twitter news technology trends future innovation technews
344	 definitely need to improve twitter dopamine cortisol ratio 
345	 agree elonmusk elonmusknews tesla starlink spacex 
346	 makes bold move will other media companies and news orgs follow 
347	cbs news to temporarily go dark on twitter amid uncertainty on the platform 
348	the us government still isn sure about elon musk twitter science tech culture 
349	 twitter elonmusk business news billionaire elon musk has previously and repeatedly stated that 
350	 tech newsflash elon musk starts twitter poll on whether to reinstate trump technology bot news
351	 tech newsflash elon musk twitter poll suggests president trump will be reinstated on the platform 
352	 music musicnews news rock twitter trent reznor on desire to bail on twitter after elon musk takeover we don 
353	 what does an inventor the likes of elon musk have to say about society ills plenty read freeman explains joh 
354	donald trump on course for twitter comeback after elon musk poll news comeback donald elon musk poll trump 
355	the pentagon says it testing elon musk starlink in the arctic which could help connect us troops 
356	elon musk asks twitter users to vote on ending donald trump ban on social media site news world 
357	elon musk starts twitter poll on whether to bring back trump dailybusiness business finance news 
358	scammer anna sorokin said elon musk is one of her dream dinner guests news anna dinner dream elon guests 
359	elon musk insane strategy to bring donald trump back to twitter twitter tesla tsla ukraine poland news 
360	 elon musk chainsaw strategy does not bode well for twitter future source news sky
361	 tech newsflash analysis the establishment scrambles to crush its agenda worst nightmare 
362	 tech newsflash not so fast elon europe warns musk he must hire hundreds of moderators to limit free speech 
363	twitter is just insane right now full video skit sketch elonmusk elon musk 
364	exclusive alex jones responds to elon musk no socialmedia news breakingnews
365	exclusive alex jones responds to elon musk no america news trump infowars freespeech politics
366	elon musk twitter teeters on the edge after another leave ht heritagetimes news 
367	twitter has chance of major crash during world cup says insider news
368	just hours after saying he had not yet decided on whether to lift the twitter ban on donaldtrump the social netw 
369	just hours after saying he had not yet decided on whether to lift the twitter ban on donaldtrump the social netw 
370	tech roundup wall street reacts to cisco nvidia results and more fallout from elon musk new twitter 
371	 tech newsflash elon musk needs to learn that more debate does not mean more truth technology bot news
372	 tech newsflash peter roff supporters of elon musk twitter crusade may be disappointed in the long run 
373	 tech newsflash elon musk needs to learn that more debate does not mean more truth john naughton 
374	twitter has chance of major crash during world cup says insider driving news
375	twitter has chance of major crash during world cup says insider driving news
376	over million people vote in twitter poll by elon musk to reinstate the twitter account of former president tru 
377	 ethereum news past h discover more full article trading 
378	 metaverse news and opinion usa the shock of twitter owner elon musk prophetically reporting twitter may not 
379	tesla board view that elon musk is irreplaceable emerged in pay trial via wsj news wsj
380	 gm has said it plans to overtake tesla ceo elon musk in outright vehicle sales and will challenge him on the home 
381	elon musk echoing adl talking points says new twitter policy is freedom of speech but not freedom of reach 
382	elon musk echoing adl talking points says new twitter policy is freedom of speech but not freedom of reach 
383	elon musk to sack half of twitter staff and end working from home read more news 
384	elon musk to sack half of twitter staff and end working from home read more news 
385	prolly so he can write it himself everyone went on long vacation elonmusk twitter msn news
386	elon musk sends an email to twitter engineers inviting them to his office elon musk twitter tesla spacex meme 
387	 tech newsflash don be swayed by elon musk ashneer grover word of advice on mass layoffs 
388	 tech newsflash spent week on mastodon the social media platform some are turning to as they abandon el 
389	 tech newsflash elon musk asks twitter users to vote on whether to reinstate donald trump account 
390	as elon musk purchases twitter people are asking one question will he destroy callum grady twitter account 
391	elon musk says btc will make it things to know in bitcoin this week bitcoin news bitcoinnews
392	the exodus at twitter may have been the plan all along maybe by 
393	 tesla news past h discover more full article trading news 
394	 tech newsflash elon musk starts twitter poll on whether to bring back trump technology bot news
395	 tech newsflash reinstate trump elon musk asks twitter days after the announcement hindustan times 
396	 tech newsflash should donald trump be reinstated on twitter elon musk starts poll the indian express 
397	 tech newsflash elon musk launches twitter poll asking whether to reinstate ex us president donald trump 
398	 tech newsflash as twitter erupts in chaos elon musk posts poll on reinstating trump account 
399	 tech newsflash tech healer couple flew to sf on private jet to help heal elon the san francisco standar 
400	 tech newsflash here how twitter breaks under ceo elon musk according to experts business insider 
401	 tech newsflash quitting elon musk twitter here how to join mastodon technology bot news
402	 crypto news will trump be back on twitter elon musk asks twitter users to decide in poll 
403	twitter fate in doubt as employees defy elon musk ultimatum fears grew that fresh exodus would threaten the very 
404	 crypto news elon musk polls to reinstate trump account 
405	 news elon musk poll to bring back trump to twitter breaks records million votes in just hours 
406	indian twitter alternative koo offers to hire employees fired by twitter read more 
407	elon musk tells twitter engineers to fly in for meeting report news 
408	elon musk tells twitter engineers to fly in for meeting report news 
409	elon musk bans twitter staff from working from home in new email read more news 
410	elon musk bans twitter staff from working from home in new email read more news 
411	angry messages beamed onto twitter hq amid elon musk employee cull news tech twitter elonmusk angry message 
412	after initially telling twitter employees that the company offices would be closed until monday new owner elon 
413	 elon musk asks twitter users to vote on reinstatement of donald trump source news sky
414	elon musk gives ultimatum to remaining twitter staff in email go hardcore or leave news 
415	elon musk asks twitter users if trump should be reinstated socialmedia news breakingnews
416	 news via nyt by yoel roth was the head of trust and safety at twitter this is what could become of it 
417	 was the head of trust and safety at twitter this is what could become of it via trending news
418	elon musk asks twitter users to vote on reinstatement of donald trump news
419	late night writer pop culture news midterm late night writer pop culture news midterm election night 
420	andrew twiggy forrest slams tesla elon musk over hydrogen read more news 
421	andrew twiggy forrest slams tesla elon musk over hydrogen read more news 
422	elon musk new twitter policy suppressing hate tweets sparks confusion comparisons to shadowbanning 
423	elon musk asks twitter users to vote on bringing back donald trump account tmz news 
424	giant sculpture of elon musk as goat riding rocket is coming to austin news 
425	elon musk announces new twitter policy to tackle hate speech stay tuned to for more updat 
426	elon musk summons twitter engineers to headquarters amid mass resignations news topstories breakingnews
427	negative tweets to be deboosted demonetised elon musk announces new twitter policy news dailyhunt 
428	elon musk starts twitter poll on whether to reinstate donald trump account after introducing new policy on hate twe 
429	elon musk starts twitter poll on whether to bring back trump news tech technology technews 
430	elon musk launches twitter poll about reinstating donald trump account via wsj news wsj
431	elon musk is asking twitter users to vote on bringing donald trump back to the bird app 
432	elon musk says decision on reinstating trump not yet made via wsj news wsj
433	 elon musk encourages twitter engineers to fly in for in person meetings email news 
434	elon musk encourages twitter engineers to fly in for in person meetings email news tech technology technews 
435	why every twitter user should archive and lock down their data elon musk acquired twitter in late october and almo 
436	trolls are already abusing elon musk new twitter verification system impersonating everyone from george bush to 
437	 elon musk twitter teeters on the edge after another leave via trending news
438	elon musk mocks senate democrats as clueless for their calls to investigate twitter 
439	 news via nyt by ryan mac mike isaac and kellen browning elon musk twitter teeters on the edge after another 
440	 first world cup match on sunday watch on twitter for best coverage real time commentary 
441	 elon musk tells twitter engineers to fly in for meeting report business and economy news 
442	 in the news at pm the world cup will kick off amid elon musk twitter chaos and nobody knows what happens next
443	elon musk twitter teeters on the edge after another leave news tech technology technews 
444	after elon musk ultimatum twitter employees start exiting dailybusiness business finance news 
445	 tech newsflash elon musk begins unbanning accounts debuts new twitter policy and more 
446	 tech newsflash timeline of elon musk tumultuous twitter takeover technology bot news
447	 tech newsflash elon musk restores babylon bee to twitter promises to shadowban wrongthink 
448	 tech newsflash why twitter users should stop crying over its potential downfall technology bot news
449	 tech newsflash twitter rumors unpacked elon musk building access space karen and more 
450	 tech newsflash pronatalism explained why tech titans like elon musk want to have tons of kids to save th 
451	 tech newsflash ceos can bully their employees anymore elon musk failed ultimatum to twitter employees 
452	 tech newsflash elon musk twitter meltdown is spectacle we can look away from cnet 
453	 metaverse news and opinion usa repost trending writerslift repost share writingjobs writingcommunity 
454	music news cent ice more react to twitter possible implosion news 
455	ex twitter employees are left in limbo with thousands in expenses after elon musk layoffs and ultimatum exodus 
456	elon musk other company tesla bursts into flames on pennsylvania highway socialmedia news breakingnews
457	former twitter head of trust and safety argues that apple and google have the most sway on policy yoel roth briefl 
458	 gamification news was the head of trust and safety at twitter this is what could become of it 
459	read elon musk friday emails to twitter engineers asking them to come to the office via cnbc news cnbc
460	world exclusive alex jones responds to elon musk denying his return to twitter america 
461	world exclusive alex jones responds to elon musk denying his return to twitter socialmedia news breakingnews
462	after twitter planned to close offices for the day elon musk asks engineers to come in via cnbc news cnbc
463	opinion why those of us on twitter are saying was here více zde zpráva zpravy_ 
464	elon musk announces negative hate tweets to be deboosted demonetised under the new twitter policy 
465	elon musk restores babylon bee to twitter promises to shadowban wrongthink socialmedia news breakingnews
466	elon musk twitter teeters on the edge after another leave news tech technology technews 
467	 news twitter twitter in shambles following elon musk twitter ultimatum mass employee resignations 
468	elon musk twitter teeters on the edge after another leave news tech technology technews 
469	news from the time reports elon musk twitter teeters on the edge after another leave 
470	 elon musk twitter teeters on the edge after another leave by by ryan mac mike isaac and kellen browning 
471	elon musk twitter teeters on the edge after another leave news tech technology technews 
472	elon musk twitter circus gets tesla booted from top investments list read more 
473	elon musk twitter circus gets tesla booted from top investments list read more 
474	 tech newsflash how elon musk came to own twitter timeline of the tesla ceo takeover 
475	 tech newsflash elon musk asks twitter software engineers to report to office email technology bot news
476	 tech newsflash with twitter in chaos some ways to protect your account technology bot news
477	 tech newsflash would the death of twitter make the world better place technology bot news
478	 tech newsflash elon musk inherited twitter child abuse nightmare experts say he making it worse 
479	 tech newsflash elon musk calls for anyone left at twitter who can write software to meet him and help him 
480	 tech newsflash elon musk asks twitter software engineers to report to office email reuters 
481	after twitter planned to close offices for the day elon musk asks engineers to come in news
482	jordan peterson restored to twitter by elon musk news
483	breaking elon musk restores the babylon bee twitter account let that sink in news
484	 no elon musk denies request to bring alex jones back to twitter developing socialmedia news breakingnews
485	 no elon musk denies request to bring alex jones back to twitter developing america 
486	 techradar live blog twitter chaos elon musk just made some big policy decisions 
487	elon musk the system is collapsing because brainless americans don want to work ftx news bitcoin nvda 
488	 news twitter twitter employees are not the only ones ditching the platform as users flock to decentralized alte 
489	breaking elon musk asks twitter engineers for coingape coingape cryptonews elonmusk news twitter
490	elon musk says in court that he doesn want to be ceo of any company and tries to walk back sec insults news
491	 tech newsflash rumors swirl as twitter users speculate the platform shutdown is imminent 
492	new york ap several spacex employees who were fired after circulating an open letter calling out ceo elon musk 
493	 in the news at am twitter shuts offices amid worker exodus as many reject elon musk ultimatum
494	what would politics look like without twitter více zde zpráva zpravy_ informace 
495	 and counting things journalism loses if elon musk destroys twitter including real time feedback on stories 
496	twitter verges on collapse as workers quit in revolt against notorious union buster elon musk news by jake joh 
497	 gt what does an inventor the likes of elon musk have to say about society ills plenty read freeman explains 
498	elon musk says he not super worried about twitter staffers quitting in droves because 
499	 news elonmusk elon musk already has his successor lined up tesla board member claims 
500	good luck getting elon musk to stop tweeting news technology trends future innovation technews
501	elon musk trolls haters tweeting en mass that twitter is dead socialmedia news breakingnews
502	elon musk trolls haters tweeting en mass that twitter is dead america news trump infowars freespeech politics
503	friday live broadcast twitter hit with mass exodus but maybe that was elon musk plan all along 
504	 tech newsflash elon musk posts twitter grave meme as riptwitter trends technology bot news
505	friday live broadcast twitter hit with mass exodus but maybe that was elon musk plan all along 
506	elon musk tells twitter staff at all hands meeting that bankruptcy is not out of the question read more 
507	elon musk tells twitter staff at all hands meeting that bankruptcy is not out of the question read more 
508	elon musk clever plan to destroy twitter and save us all politico read more 
509	elon musk clever plan to destroy twitter and save us all politico read more 
510	elon musk sets more in office requirements at twitter elonmusk trendingnow news taksim
511	we analysed million news articles on tesla twitter and elon musk to find out what exactly influences the comp 
512	there is no replacement for black twitter news technology trends future innovation technews
513	can elon musk turn twitter into an everything app news technology trends future innovation technews
514	 ethereum news past h discover more full article trading 
515	metro elon musk hardcore twitter ultimatum seems to have backfired badly news tech twitter 
516	reports say twitter employees appear to quit following elon musks deadline read more 
517	 news bitcoin btc doge dogecoin elon musk dogecoin btc and ethereum have bright future will doge price hit 
518	elizabeth warren gets fact checked by elon musk twitter democrats caught lying again 
519	 tech newsflash sabotage shy musk boards up twitter offices as staffers flock to quit report 
520	 tech newsflash billionaires like elon musk want to save civilization by having tons of genetically superior 
521	 tech newsflash elon musk cracked jokes as users of his billion acquisition prepped for the twilight of 
522	 tech newsflash twitter closes offices after elon musk loyalty oath sparks wave of resignations 
523	in this weeks the trademark lawyer newsletter trademark ignorance is burning elon musk twitter to the ground re 
524	twitter staff at loggerheads with elon musk twitter news itvideo 
525	hundreds of staff have reportedly resigned after the site new owner gave them an ultimatum 
526	twitter headquarters projection activist mocked new owner elon musk and displayed hateful messages on the wall 
527	elon musk sent an email to his employees in which he asked them to choose between working long hours at high intens 
528	elon musk stated in court that he doesn desire to lead any company as ceo while responding to queries from atto 
529	 news riptwitter czbinance elonmusk twitter in the ongoing rip twitter trend on twitter binance ceo changpen 
530	following elon musk deadline for staff to either accept his extremely hardcore way of working or leave the comp 
531	twitter headquarters projection activist mocked new owner elon musk and displayed hateful messages on the wall 
532	hundreds of employees say no to being part of elon musk extremely hardcore twitter news
533	 metaverse news and opinion usa repost trending trendingnow writerslift repost share writingjobs 
534	after elon musk ultimatum twitter employees start exiting news tech technology technews 
535	employees at twitter begin leaving after elon musk hardcore ultimatum business news 
536	twitter temporarily shut all its offices after hundreds of employees reportedly resigned following elon musk ulti 
537	cw bird site bin fire bbc elon musk twitter locks staff out of offices until next week employees have been twe 
538	elon musk has said that he expected to reduce his time at twitter and eventually find new leader to run the socia 
