	title
0	Russia-Ukraine stay updates: Ukraine refutes US estimates on troop deaths, accidents. Click on the link below and know the details.
1	U.S. Army's weapons contract reviews accelerate to replace Ukraine aid
2	Canada sanctions 22 Belarusian officials over Ukraine war as opposition leader visits
3	Ukraine receives 2.5 billion euros in assistance from EU
4	Millions of lives under threat in Ukraine this winter - WHO
5	European Commission disburses EUR 2.5B in aid to Ukraine
6	Jailed Russian policeman Sergei Kadatsky selected to fight in Ukraine killed while fighting for Putin
7	Russia's Black Sea Fleet in Jeopardy After Ukraine Strike—U.K.
8	Britain provides Ukraine with advanced model of laser-guided Brimstone missile
9	Germany To Deploy Patriot Air Defense System Along Poland's Border With Ukraine
10	Millions of lives under threat in Ukraine this winter - WHO
11	Vladimir Putin Forced To Borrow Nearly $12 Billion To Fund War Against Ukraine As Russian Forces Continue To Struggle
12	Vladimir Putin Forced To Borrow Nearly $12 BILLION To Fund War Against Ukraine As Russian Forces Continue To Struggle
13	/r/WorldNews Live Thread: Russian Invasion of Ukraine Day 272, Part 1 (Thread #413)
14	Russian officials flailing amid fears Ukraine could launch operation to liberate Crimea: report
15	Ukraine Should Worry: Russia Is Going All In On Drones From Iran
16	US monitoring alleged executions in Ukraine, says war crimes envoy
17	Ukraine Claims Crimea Secretly Being Mobilized as Kremlin Denies 2nd Draft
18	Russians accused of burning bodies at Kherson landfill | Ukraine
19	Ukraine marks the Day of Dignity. The winter that changed Ukraine happened in 2014.
20	Russia to build attack drones for Ukraine war with the help of Iran, intelligence assessment says
21	Millions of lives at risk as winter bites in war-torn Ukraine
22	NATO: Defending Ukraine Is Defending Democracy
23	Ukraine claims Russia planning false flag attack on Belarus nuclear plant
24	Poland to put German Patriot missiles near border with Ukraine
25	Ukraine shows how space is now central to warfare
26	Ukraine to start evacuations in Kherson and Mykolaiv regions as winter sets in. Fears war damage to infrastructure is too severe for civilians in newly liberated areas of south to survive
27	Poland to put German Patriot missiles near border with Ukraine
28	"Polish PM: ""Use frozen Russian assets to help Ukraine"""
29	Ukraine to probe POWs dispute as war crimes blame game erupts again
30	Spain to provide police and military training assistance to Ukraine
31	Video Shows 2 Russian Soldiers Arrested For Refusing To Fight In Ukraine War
32	NATO chief urges alliance states to ramp up weapons production to continue support for Ukraine
33	Russia rejects IAEA investigation into Ukraine 'dirty bomb' claims
34	"Ukraine nuclear power plant attacked by Russia, worker tells CBS News, as IAEA warns of ""close call"""
35	Russia Confident Ukraine Lacks Strength to Retake Crimea: Senator
36	Ukraine shows how space is now central to warfare
37	France gives Ukraine Crotale systems to counteract Russian missile strikes
38	Vodafone Ukraine to maintain skeleton network in case of full blackout, says CEO
39	Vodafone Ukraine to maintain skeleton network in case of full blackout.
40	Talks Are 'Strategic Mistakes' That Will Give Putin Time To Create 'Giant Ticking Bomb': Ukraine
41	Russia Urges Global Response Over Strikes On Ukraine Nuclear Plant
42	Aid sought for Moldova, hit hard by war in next-door Ukraine
43	Russia accuses Ukraine of executing more than 10 POWs
44	FIFA chief urges ceasefire in Ukraine during WC
45	Italy to extend Ukraine arms supply law for 2023 - minister
46	"Polish PM: ""Use frozen Russian assets to help Ukraine"""
47	Russia-Ukraine war live news: Russia launched 400 strikes on Sunday, Zelenskiy says; UN to inspect Zaporizhzhia plant | Ukraine
48	Kyiv is 'simply a Russian city' Dmitry Medvedev taunts Ukraine after claims of liberating Crimea soon
49	'Playing with fire' UN warns as team to inspect damage at Ukraine nuclear plant
50	/r/WorldNews Live Thread: Russian Invasion of Ukraine Day 271, Part 1 (Thread #412)
51	Russia rejects IAEA investigation into Ukraine 'dirty bomb' claims
52	Zelensky says eastern Ukraine hit with 400 shelling incidents in single day
53	Russia rejects IAEA investigation into Ukraine 'dirty bomb' claims
54	Russia-Ukraine war will end on Ukraine’s terms – British envoy to Nigeria
55	Russia Plans 'Terrorist Attacks' On Belarus, Will Blame Ukraine And NATO: Defense Intel
56	Shells hit near nuclear plant; Blackouts roll across Ukraine
57	Ukraine Is Beating Russia On The Battlefield And Doesn’t Want To Negotiate
58	"Russian conscripts have ""no clue what to do"" in Ukraine: Soldier's wife"
59	Ukraine says Russians pounding frontline positions with artillery
60	At least 437 Ukraine children killed in war by Russia: Ukraine official
61	"Ukraine war offers preview of a world of ""tyranny and turmoil"" says Pentagon chief"
62	Ukraine nuclear plant shelled, UN watchdog says
63	Russian soldiers are surrendering to Ukrainian drones, Ukraine says
64	Ukraine-Russia war: Crimea could be reached before end of year, general predicts | news.com.au
65	Iran to help Russia build drones for Ukraine war, Washington Post reports
66	Ukraine Latest: US Defense Chief Warns About Potential Nuclear Spiral
67	Ukraine nuclear power station shelled, U.N. nuclear watchdog says
68	She left the dangers of Ukraine only to be killed riding a bike close to home. Hundreds rode in her honor to demand change
69	Israel’s Arms Exports Flourish Amid Ukraine War, Iran and Abraham Accords 2021 was a record year for Israel’s arms exports.
70	Chechen Separatist Fighters Defend Ukraine Against 'Common Enemy' Russia
71	Negotiating with Moscow would be capitulation: Ukraine
72	Iran to help Russia build drones for Ukraine war, Post says
73	Ukraine to begin voluntary evacuation from Kherson: Deputy PM
74	Austin warns Russian war on Ukraine could lead to a ‘dangerous spiral of nuclear proliferation’
75	/r/WorldNews Live Thread: Russian Invasion of Ukraine Day 270, Part 1 (Thread #411)
76	'No One Is Listening To Us': Since Mobilization, Russian Women Have Stepped Up Protests Against Ukraine War
77	Ukraine says around 60 Russians killed in long-range shelling attack
78	US pressures Ukraine to weigh talks with Russia
79	Ukraine 'could reach Crimea by Christmas' according Ukraine's deputy defence minister
80	Ukraine says around 60 Russians killed in long-range shelling attack
81	Ukraine war: Rishi Sunak visits President Zelensky in Kyiv as he pledges GBP 50m in aid
82	US pressures Ukraine to weigh talks with Russia
83	Iran will help Russia build drones for Ukraine war, Western officials say
84	Massive explosion hits Russian Gazprom gas pipeline amid suspicions of sabotage linked to Putin's war on Ukraine
85	U.S. defence secretary stresses importance of continued support for Ukraine
86	Russian chess legend says war in Ukraine is a 'battle between freedom and tyranny'
87	Massive explosion hits Russian Gazprom gas pipeline amid suspicions of sabotage linked to Putin's war on Ukraine
88	Sunak visit and £50M aid to Ukraine: Rishi Sunak visits President Zelensky in Kyiv as he pledges £50m in aid - BBC News
89	UK prime minister visits Kyiv to show support for Ukraine
90	12ft | Rishi Sunak meets Volodymyr Zelensky in first visit to Ukraine as PM.
91	Rishi Sunak meets Volodymyr Zelensky in first visit to Ukraine as PM.
92	Gates Foundation pledges $7 billion for Africa as Ukraine war diverts donor cash
93	Ukraine&amp;#x27;s Zelenskiy says he met UK PM Sunak in Kyiv
94	Zelenskiy Says No Peace Until Ukraine Gets Crimea, Donbas Back
95	Ukraine rules out ‘short truce’ with Russia
96	Netherlands turns top buyer of Indian petro-products amid Ukraine war
97	Ukraine president's chief of staff: peace 'only' possible after return to '91 borders
98	'Relentless' Ukraine Troops See Golden Opportunity in Winter Warfare
99	Banksy Reveals Seven Murals Throughout War-Torn Ukraine
100	Ukraine war: 10 million without power after Russian strikes
101	Ukraine war: Almost half Ukraine's energy system disabled, PM says
102	Ex-Japan PM harsh on Zelenskyy over war in Ukraine
103	Russia fires cruise missiles with nuclear warhead simulator at Ukraine
104	/r/WorldNews Live Thread: Russian Invasion of Ukraine Day 269, Part 1 (Thread #410)
105	Ukraine war: Were Russian soldiers shot after surrendering?
106	Ukraine will produce heavy weapons and military equipment jointly with at least six NATO countries
107	Top US general argues Ukraine may be in a position of strength to negotiate Russian withdrawal
108	US is running low on some weapons and ammunition to transfer to Ukraine | CNN Politics
109	Russia Fires Nuclear Warhead at Ukraine—Kyiv False
110	Russia accuses Ukraine of executing prisoners of war
111	The world's largest plane – destroyed in the Russian invasion of Ukraine – is being rebuilt in a secret location at a cost of half a billion euros.
112	Ukraine experts join probe of fatal missile blast in Poland
113	Netherlands has given Ukraine over €800 million in military support
114	Russian Spy Defects, Calls Putin's Ukraine War 'Worst Scenario' Imaginable
115	Russia accuses Ukraine of executing more than 10 POWs
116	Ukraine Maritime Drone Strikes Again: Reports Indicate Attack On Novorossiysk - Naval News
117	Russia Now Firing S-300 Surface-To-Air Missiles At Land Targets In Ukraine: Official (Old news from July)
118	Hungary will not support EU aid plan to Ukraine, Orban says
119	EU to launch its own communications satellite network | The European Union hopes to have its own communications satellite system up and running by 2027. The importance of the project became clear after Russia's invasion of Ukraine.
120	Putin ends the war in Ukraine (how it should go down)
121	Russia hit energy infrastructure, 'military targets' in Ukraine -Russian media
122	Israel Caves Into US Pressure, Agrees To Provide 'Strategic Materials' To Ukraine
123	Ukraine: The Soviet-era anti-aircraft system that likely missfired on Poland
124	Banksy shows how he created graffiti in Ukraine – video
125	Gates Foundation pledges $7 billion for Africa as Ukraine war diverts donor cash
126	Ukraine war: 10 million without power after Russian strikes
127	As Ukraine War Drags On, US Running Low On Some High-End Weapons: Report
128	Two fighter jets escort Qatar-bound Poland football team close to Ukraine border
129	Incredible moment Qatar-bound Poland team got fighter-jet escort near Ukraine
130	"""Ukraine War Is Your Problem Too"": France President Macron Tells Asian Countries"
131	/r/WorldNews Live Thread: Russian Invasion of Ukraine Day 268, Part 1 (Thread #409)
132	Zelenskiy Says No Peace Until Ukraine Gets Crimea, Donbas Back
133	Xi-Putin no longer friends? China distances itself from Russia by signing communique condemning Ukraine war
134	Dutch court sentences three to life in prison for 2014 downing of MH17 over Ukraine
135	Dutch court sentences three to life in prison for 2014 downing of MH17 over Ukraine
136	Mercenaries deploy thermobaric weapons in Ukraine
137	Video Shows Russians 'Chased' Out of Kherson By Artillery Fire: Ukraine
138	West ‘should not dictate’ peace terms to Ukraine, says Czech foreign minister. Jan Lipavský says western backers should recognise Ukraine is fighting against Russia to protect all Europe
139	Finland sending 10th military aid package to Ukraine
140	Ukraine tells allies it may not be able to recover from more Russian attacks on energy systems
141	Cold, dark confusion grips Ukraine after Putin’s missile barrage | Russia is trying to wear down resistance by targeting civilian infrastructure as winter draws in.
142	Dutch court convicts 2 Russians, 1 Ukrainian of murder in 2014 Malaysian jet downing over Ukraine
143	Japan, China leaders to work for stable ties, oppose nuke use in Ukraine
144	We're Victoria and Adam from Sky News UK's Forensics team. We use OSINT techniques to verify, investigate and explain global news stories to our audiences. We've had a busy year working on the Ukraine war and other big stories. AMA!
145	Zelenskiy Says No Peace Until Ukraine Gets Crimea, Donbas Back
146	Poland, NATO say missile that killed two likely fired by Ukraine defending against Russian attack | CNN
147	Judges say Russian-made missile brought down flight MH17 over Ukraine in 2014
148	'That's not the evidence': Ukraine clashes with its allies over Poland blast in a rare public split
149	Dutch court says Russia had 'overall control' of separatists in Ukraine at time of MH17 downing
150	Under U.S. Pressure, Israel Funded ‘Strategic Materials’ for Ukraine
151	Top US general argues Ukraine may be in a position of strength to negotiate Russian withdrawal | CNN Politics
152	Ukraine Claims 'Russian Trace' In Poland Incident, Slams Moscow For Pushing Stray Missile 'Conspiracy'
153	Russia blocks Novaya Gazeta website | The independent news outlet was forced to suspend publication in March after Russia invaded Ukraine, months after editor Dmitry Muratov won the Nobel Peace Prize for defending press freedom
154	Russia blocks Novaya Gazeta website - The independent news outlet was forced to suspend publication in March after Russia invaded Ukraine, months after editor Dmitry Muratov won the Nobel Peace Prize for defending press freedom
155	Russia launches missile strikes, fighting rages in east Ukraine
156	Russia's economy has finally fallen into recession, 8 months after it invaded Ukraine
157	Financial Times: A NATO country diplomat told @FT that Zelensky’s still insisting Ukraine wasn’t behind the Poland hit: “This is getting ridiculous. The Ukrainians are destroying [our] confidence in them… they are openly lying. This is more destructive than the missile.”
158	Ukraine Offers Russians Who Surrender 'Comfortable Conditions': Three Meals Daily, Medical, Phone Calls
159	Belarus Invasion Of Ukraine Is 'Only A Matter Of Time': Political Strategist
160	EU to provide aid to Ukraine over winter before possible hostility flareup
161	Biden disputes Ukraine leader comments that missiles that landed in Poland weren't Ukrainian
162	Russia launches more missile strikes, fighting rages in east Ukraine
163	Russia launches new Ukraine barrage as grain deal extended
164	Ukraine will probably get access to blast site, says Polish official
165	Ukraine will probably get access to blast site, says Polish official
166	Billionaire Andrew Forrest launches $25bn fund for reconstructing Ukraine – Australian mining billionaire has launched an investment fund that is hoped will be worth at least $25bn (£21bn) to help rebuild war-torn Ukraine. Mr Forrest and his wife have committed $500m to the fund
167	Russia launches another wave of missile strikes across Ukraine
168	A 'barbed wire curtain' rises in Europe amid war in Ukraine
169	Ukraine Intelligence Finds American Parts Used In Iranian Drones: Report
170	Russia's economy has finally fallen into recession, 8 months after it invaded Ukraine
171	'I Got My Home Back': Elation And Relief In Kherson As Ukraine Recovers A Key City
172	Ukraine refuses to accept it was behind Poland missile strike, despite NATO forgiveness
173	Ukraine war: Risks of spillover ‘remain all too real’, Security Council hears
174	Russian missile strike hits Ukraine's Odesa region – Russian missile strike hits southern Odesa region of Ukraine for the first time in weeks, regional governor says. The attack comes two days after Russia's nationwide strikes plunged Ukraine into darkness and led to a missile hitting Poland
175	Ukraine war: Billionaire Andrew Forrest launches $25bn fund for reconstruction
176	Judges to rule in murder trial for 2014 downing of flight MH17 over Ukraine
177	Responding to Ukraine President Zelensky’s remarks tonight, a NATO country diplomat said: “This is getting ridiculous. The Ukrainians are destroying [our] confidence in them. Nobody is blaming Ukraine and they are openly lying. This is more destructive than the missile.”
178	Responding to Ukraine President Zelensky’s remarks tonight, a NATO country diplomat said: “This is getting ridiculous. The Ukrainians are destroying [our] confidence in them. Nobody is blaming Ukraine and they are openly lying. This is more destructive than the missile.”
179	Adoption of plant-based diets across Europe can improve food resilience against the Russia–Ukraine conflict
180	Ukraine war: Billionaire Andrew Forrest launches $25bn fund for reconstruction
181	Ukraine claims that a Ukrainian sniper made the second-longest combat kill ever
182	Ukraine conflict intensifies in east; NATO, Poland say missile likely not from Russia
183	Ukraine war: Billionaire Andrew Forrest launches $25bn fund for reconstruction
184	/r/WorldNews Live Thread: Russian Invasion of Ukraine Day 267, Part 1 (Thread #408)
185	3,500 Russians Soldiers Have Already Requested To Surrender To Ukraine Army: Report
186	Ukraine war: Nato says Poland probably hit by Ukrainian missile
187	China Attacking Taiwan Would Be 'Mistake' Like Russia's in Ukraine, US General Says
188	Ukraine supporters want University of North Georgia to cancel Russia event
189	Rep. Adam Smith: Ukraine ‘right to blame Russia’ for missile that struck Poland
190	Bush calls ZelensBush calls Zelenskyy ‘tough dude,’ says Ukraine can win
191	A Zambian Student Sent To Prison In Russia Wound Up Dead In Ukraine
192	Ukraine says it killed some 50 Russian soldiers in artillery attack
193	"The White House: Russia is responsible for the incident in Poland ""Russia has unleashed a flurry of missiles on Ukraine specifically designed to destroy civilian infrastructure.Ukraine has every right to defend itself,"" National Security Council spokeswoman Adrienne Watson said."
194	Turkey's Erdogan says he believes the U.N.-brokered grain export deal between Russia and Ukraine will be extended beyond its Nov. 19 deadline, adding that Ankara is making efforts to extend it by a year.
195	U.S. to support Ukraine for as long as it takes against Russia - Says Pentagon
196	Polish president says missile probably came from Ukraine defences
197	Russia-Ukraine war live: Zelenskiy dismisses Nato’s suggestion missile that hit Poland was Ukrainian
198	Ukraine war latest: Ukraine air defence likely caused Poland explosion - Nato chief
199	‘China can play mediating role’: Macron to visit Xi Jinping over war in Ukraine | French president believes China can help push Russia to de-escalate Ukraine war
200	ukraine war what do you all think
201	NASAMS air defense system have 100% success rate in Ukraine- Pentagon chief
202	Putin unleashes fury with 100 missiles across Ukraine after humiliation at G20
203	NASAMS air defense system have 100% success rate in Ukraine- Pentagon chief
204	Missile that hit Poland fired by Ukraine forces - US officials
205	NATO Says Missile That Hit Poland Was Likely Ukraine Air Defense
206	Ukraine alleges 'Russian trace' in Poland blast
207	Ukraine war: Poland says missile deaths an unfortunate incident
208	NASAMS air defense system have 100% success rate in Ukraine- Pentagon chief
209	BREAKING NEWS ZELENSKY UKRAINE HAS BOMBED POLAND KILLING TWO FARMERS
210	Ukraine war latest: Ukraine air defence likely caused Poland explosion - Nato chief - BBC News
211	Russian spying in Europe dealt 'significant blow' since Ukraine war, MI5 chief says
212	Russia-Ukraine war live: missile strike that killed two in Poland likely an accident from Ukrainian air defence, says Warsaw
213	Polish president says 'very likely' missile was from Ukraine air defence
214	Poland's president says missile that killed two likely fired by Ukraine in defense against Russian attack
215	Polish president says 'very likely' missile was from Ukraine air defence
216	Poland Says Missile Was Likely Fired by Ukraine Air Defense but Blames Moscow
217	Ukraine backers get behind probe of missile blast in Poland
218	Russia-Ukraine war live: missile strike that killed two in Poland likely an accident from Ukrainian air defence, says Warsaw | Ukraine
219	Russia-Ukraine war live: missile strike that killed two in Poland likely from Ukrainian air defence, says Warsaw
220	Ukraine races to restore power after Russian missile barrage
221	Ukraine war latest: Allies trying to establish facts behind Poland missile hit, says Rishi Sunak - BBC News
222	US official now admits blast in Poland caused by stray missile fired by Ukraine
223	Fuel Depot Explodes in Southern Russia Near Ukraine
224	Poland Missile Blast: Latest Among Several Mysteries Threatening To Escalate Russia-Ukraine War
225	G20 lеаders dесlaration denounces ‘Russian aggression’ in Ukraine | Russia-Ukraine war News
226	Biden said Ukraine air defence missile responsible for Poland blast - NATO source
227	Russia says its strikes in Ukraine were no closer than 35km to Polish border
228	Missile That Hit Poland Likely Launched by Ukraine in Air Defense, Western Officials Say
229	Biden requests $37.7 bln for Ukraine from Congress
230	Live: Poland blast an attempt to spark NATO-Russia clash – Moscow | Russia-Ukraine war News
231	UK PM slams Russia for firing missiles as G20 sought Ukraine war resolution
232	Western allies look to Ukraine as a testing ground for weapons
233	Sweden promises $287 mln military aid package to Ukraine including air defence
234	G20 leaders declaration denounces ‘Russian aggression’ in Ukraine
235	Poland strike caused by Ukraine firing at incoming Russian missile : US officials
236	Ukraine war: Russia denies responsibility for Poland blast
237	G20 leaders declaration says deplores Russian aggression against Ukraine
238	Turkey's Erdogan sees no losers from peace between Ukraine, Russia
239	Ukraine war: Russia denies responsibility for Poland blast
240	Ukraine war latest: Poland 'set to trigger NATO Article 4' after missile hits territory killing two
241	White House requests $38 billion more in Ukraine aid
242	Ukraine war: Russia denies responsibility for Poland blast
243	French Politician Says Helping Ukraine By Sending Weapons 'Only Prolong' The War, Encourage Conflict
244	/r/WorldNews Live Thread: Russian Invasion of Ukraine Day 266, Part 1 (Thread #407)
245	New Banksy Works Emerge Among the Destruction in Ukraine
246	Russian missiles hit Polish Przewodow directly at the electricity power line which connects the EU with Ukraine
247	Russian Foreign Minister Leaves Bali Summit Early after Blaming Ukraine
248	Ukraine’s Foreign Minister urges NATO to provide Ukraine with modern aircraft and anti-aircraft defence so that it can shoot down all types of Russian missiles
249	Russian missiles land in NATO state Poland on Ukraine border killing two
250	White House requests $37.7 billion in new Ukraine funding
251	"Revealed! ""Putin's Ukraine War Is In Trouble, Doubt If He Will Survive The War"" - Walsh"
252	Poland holds emergency security meeting after reports of fatal explosion, as Russian missiles bombard nearby Ukraine
253	Ukraine takes back city of Kherson
254	2 Killed As Russian Missile Lands In Poland, Near Ukraine Border: Report
255	Russian missiles cross into Poland during strike on Ukraine, U.S. official tells AP
256	Ukraine war latest: Russian missiles hit Poland, killing two - reports - BBC News
257	Ukraine Latest: Stray Russian Rockets Kill 2 in Poland, AP Says
258	Russian missions cross into Poland during strike on Ukraine
259	Russian missiles cross into Poland during strike on Ukraine
260	Russian missiles cross into Poland during strike on Ukraine
261	Russian missiles cross into Poland during strike on Ukraine, U.S. official tells AP
262	Russia notified by Ukraine of oil supply suspension to Hungary via Druzhba -RIA
263	Barrage Of Russian Missiles Knocks Out Energy Facilities Across Ukraine
264	EU launches military training mission for Ukraine’s armed forces | Russia-Ukraine war News
265	Some reports that the Poland missile was actually parts of a rocket shot down by Ukraine
266	Two deaths reported in Polish border town, as a wave of Russian missiles hit Ukraine | CNN
267	Explosion kills two in Poland near Ukraine border
268	Russia-Ukraine war live: two people killed after Russian missiles cross into Poland, says US intelligence official
269	Russia-Ukraine War: Russia Launches Broad Missile Attack on Ukraine’s Energy Infrastructure
270	Ukraine war: Situation 'critical' after wave of Russian missiles
271	Ukraine war: Situation 'critical' after wave of Russian missiles - Zelensky's office
272	Explosion kills two in Poland near Ukraine border
273	Explosion Kills Two in Poland Near Ukraine Border
274	Strikes put Ukraine in darkness; missiles cross into Poland
275	Russian missiles struck NATO ally Poland and killed 2 people as Putin's forces barraged Ukraine, a US defense official told the AP
276	Strikes put Ukraine in darkness; missiles cross into Poland
277	Russia-Ukraine War: Russia Launches Broad Missile Attack on Ukraine’s Energy Infrastructure
278	Strikes put Ukraine in darkness; missiles cross into Poland
279	Power outages in Moldova after Russian strikes in Ukraine
280	Two people killed after Russian missiles cross into Poland, says US intelligence official | Ukraine
281	At least two dead after Russian missile lands in Poland on Ukraine border
282	Polish media reported that two people died Tuesday afternoon after a projectile struck an area where grain was drying in Przewodów, a Polish village near the border with Ukraine. What is going to happen NOW?
283	Russian missiles land in NATO state Poland on Ukraine border killing at least two | World | News
284	At least two dead after Russian missiles land in NATO state Poland on Ukraine border
285	Russian missiles land in NATO state Poland on Ukraine border killing at least two | World | News | Express.co.uk
286	Ukraine Latest: Poland Is Hit by Russian Rockets, the AP Reports
287	Russia launches fresh missile strikes across Ukraine as G20 leaders meet
