	title
591	Ukraine war: Why is control of Kherson so important?
592	Ukraine war: US confirms 'communications' with Kremlin
593	Russia's heavy losses in Ukraine spark outcry and rare official response
594	Ukraine war: Russia and US 'discuss holding talks on nuclear weapons' - as Putin's troops 'prepare for street fighting' | World News
595	Russia-Ukraine War: Ukraine Says Russia Is Trying to Make Life Unbearable in Kherson
596	Row brews in Iran over use of its drones in Ukraine war by Russia
597	Russian marines complain of 'incomprehensible' losses in Ukraine
598	Russia's war on Ukraine latest news: Zelenskiy open to 'genuine' talks with Moscow
599	India’s stance on the Ukraine war makes little sense
600	Debt, Ukraine and Hunter Biden: Republicans prepare for House majority
601	Putin’s Ukraine bombing campaign will not end well
602	Fear of Nuclear War Has Warped the West’s Ukraine Strategy
603	Ukraine a reason to act fast on climate change - Rishi Sunak
604	Ukraine war: West warned against complacency on air defence support
605	Ukraine: The Decisive Battle For Kherson
606	Ukraine war: West warned against complacency on air defence support
607	Welcome to Ukraine Red Cross Donation Portal
608	"Russia issues rare denial of ""pointless losses"" by marines in Ukraine"
609	Ukraine says Russia forces pillage, occupy Kherson homes ahead of battle
610	A Russian convoy stole an amusement park train from Ukraine and drove it out of Kherson, Ukrainian advisor claims
611	/r/WorldNews Live Thread: Russian Invasion of Ukraine Day 258, Part 1 (Thread #399)
612	Ukraine updates: Iran admits sending Russia drones as electricity knocked out (Nov. 7)
613	These 50 Brands Continue To Operate In Russia; Ukraine Calls It 'Sponsoring A Terrorist State'
614	Hungary will not support EU efforts to help Ukraine with joint funds
615	Ukraine President Volodymyr Zelenskyy awarded 2022 Liberty Medal
616	Ukraine war: US confirms 'communications' with Kremlin
617	Ukraine says Russia forces pillage, occupy Kherson homes ahead of battle
618	Row brews in Iran over use of its drones in Ukraine war by Russia
619	Ukraine war: US confirms 'communications' with Kremlin
620	North Korea makes uniforms for Russian soldiers in Ukraine, violating UN sanctions
621	Ukraine says Russian forces looting, occupying homes in Kherson
622	COP27: Ukraine a reason to act fast on climate change - Rishi Sunak
623	One with Ukraine
624	‘He needs the war to continue’: Why Putin can’t negotiate his way out of Ukraine
625	Russia-Ukraine war: Vladimir Putin ‘needs the war to continue’, says Sir Lawrence Freedman
626	Ukraine rejects peace negotiations with Russia, India’s PM Modi offered to mediate
627	Ukraine Prepared to Negotiate With Russia After Putin's Out of Office
628	Ukraine bolsters defences by Belarus-Russia border amid fears of new offensive
629	Biden Advisor Secretly Warned Russia Not to Use Nukes in Ukraine: WSJ
630	Germany: Ukraine should decide when to hold peace talks with Russia
631	Ukraine receives first delivery of NASAMS air defence systems
632	Ukraine receives air defence systems as Russia continues air strikes
633	Hungary reacts to Putin's remarks suggesting it might have territorial claims in Ukraine
634	Ukraine says it never refused to negotiate with Russia, wants talks with Putin successor
635	Ukraine lost access to 1,300 Starlink terminals over a funding issue | Engadget
636	Rome rally urges end to Ukraine weapon funding
637	Row brews in Iran over use of its drones in Ukraine war by Russia
638	Drafted Russians were deployed to Ukraine without weapons and expected to dig trenches with their bare hands, relative says
639	Drafted Russians were deployed to Ukraine without weapons and expected to dig trenches with their bare hands, relative says
640	Another 800,000 refugees will flee Ukraine as Brit scheme faces axe
641	Germany says: Ukraine should decide when to hold peace talks with Russia
642	Ukraine receives first delivery of NASAMS air defence systems
643	Drafted Russians were deployed to Ukraine without weapons and expected to dig trenches with their bare hands, relative says
644	Russia Vs Ukraine War Update LIVE | Ukraine Govt Shares Details On Civilian Loses | English News CNN-News18
645	Russia Vs Ukraine War Update LIVE | Ukraine Govt Shares Details On Civilian Loses | English News CNN-News18
646	NASAMS and Aspide anti-aircraft systems arrive in Ukraine
647	Ukraine war just a 'warmup,' the 'big one is coming,' US admiral warns
648	Ukraine war: Kyiv Mayor Klitschko warns of evacuations if power lost
649	BREAKING NEWS: The war in Ukraine is a 'warmup', 'big bone Coming' and Ahead of US Nuclear War, Crewmate's Warning Read the full story Comment!
650	Ukraine war a ‘ warmup ’, ‘ big bone coming ’ and US nuclear war before, crewmate warns Read Full News also Comment.!
651	Russia Says Ukraine Attack Damaged Kakhovka Dam, Which Zelensky Alleged Moscow Intended To Blow Up
652	Ukraine war a ‘ warmup ’, ‘ big bone coming ’ and US nuclear war before, crewmate warns Read Full News also Comment.!
653	Ukraine war a ‘warmup’, ‘big one coming’ and US nuclear war behind, admiral warns Read Full News Then Comment.!
654	Orthodox church of Ukraine allows worshippers to celebrate Christmas on 25 December
655	Fearing War Fatigue, US Signals Ukraine To Show Openness For Talks With Russia: Report
656	Russian priest who advised women to bear more children and send them to war dies in Ukraine
657	Russia claims Ukraine hit dam near Kherson with US missiles
658	Biden administration wants Ukraine to change its stand on peace negotiations with Russia: Reports
659	Russia has committed almost 45,000 war crimes in Ukraine since Feb 24
660	Ukraine Latest: US and Russia Discussed Containing War, WSJ Says
661	Ukraine warns of more attacks on infrastructure, as mayor urges Kyiv to prepare for the worst
662	Ukraine war: Zelensky accuses Russia of &amp;#x27;energy terrorism&amp;#x27;
663	Ukraine war: Putin endorses evacuations from occupied Kherson
664	Ukraine war: Zelensky accuses Iran of lying over Russia support
665	Wiltshire Council's new homes plan to help Ukraine refugees
666	Kevin McCarthy and Ukraine: Could US elections change the war?
667	/r/WorldNews Live Thread: Russian Invasion of Ukraine Day 257, Part 1 (Thread #398)
668	Power blackouts hit Ukraine amid heavy Russian shelling
669	New research shows share of Germans who believe Russia “had to” invade Ukraine in response to “NATO provocation” has risen by 20 percent in the past six months.
670	Hungary reacts to Putin's statement about Budapest's territorial claims to Ukraine
671	U.S. encourages Ukraine to be open to talks with Russia, Washington Post reports
672	Judge in Russia-occupied Ukraine in ‘serious’ condition after assassination attempt
673	US says Zelenskiy risks allies’ ‘Ukraine fatigue’ if he rejects Russia talks – report
674	Ukraine war: Kyiv Mayor Klitschko warns of evacuations if power lost
675	Live updates: Russia’s war in Ukraine
676	Ukraine is not enough: An investigative report unveils Moscow’s plans to take over Moldova
677	Ukraine war: Kyiv Mayor Klitschko warns of evacuations if power lost
678	US says Zelenskiy risks allies’ ‘Ukraine fatigue’ if he rejects Russia talks – report
679	Ukraine says Russia destroying civilian ships on river in southern standoff
680	Ukraine war: Kyiv Mayor Klitschko warns of evacuations if power lost
681	Could India Help Broker Peace in Ukraine?
682	West Sees Little Choice but to Keep Backing Ukraine
683	Founder of Wagner PMC creates ''militia training centres'' on border with Ukraine
684	Power blackouts hit Ukraine amid heavy Russian shelling
685	Ukraine shares video showing a lone paratrooper single-handedly blowing up a Russian tank
686	Russia has failed to destroy a single HIMARS launcher to date, but Ukraine still needs more artillery: report
687	U.S. privately says to Ukraine to show Russia it’s open to negotiation
688	Ukraine war a 'warmup,' the 'big one is coming' and US behind in nuclear, admiral warns
689	Ukraine war a 'warmup,' the 'big one is coming' and US behind in nuclear, admiral warns.
690	Ukraine suffered a comms outage when 1,300 SpaceX satellite units went offline over funding issues
691	U.S. privately asks Ukraine to show Russia it's open to talks -Washington Post
692	The Biden administration is encouraging Ukraine to support peace talks with Russia nearly 9 months after invasion began, WaPo reports
693	Poland is preparing for a new wave of refugees from Ukraine
694	/r/WorldNews Live Thread: Russian Invasion of Ukraine Day 256, Part 1 (Thread #397)
695	'Never Again': Ukraine Bolsters Defenses Along Belarus-Russia Border
696	U.S. privately asks Ukraine to show Russia it's open to talks -Washington Post
697	U.S. privately asking Ukraine to drop public refusal of peace talks with Russia: Washington Post
698	U.S. privately asks Ukraine to show Russia it's open to talks, the Washington Post reports
699	U.S. privately asks Ukraine to show Russia it&amp;#x27;s open to talks, the Washington Post reports
700	Russia votes in favour of resolution condemning its actions in Ukraine
701	Judge in Russia-occupied Ukraine in ‘serious’ condition after assassination attempt
702	Attackers injure pro-Russia judge who sentenced foreigners to death in Ukraine
703	Ukraine Plans Blackouts as It Braces for Extended Loss of Power
704	Pentagon will pay to upgrade dozens of Soviet-era tanks for Ukraine
705	Canadians will be able to buy bonds to support Ukraine, PM announces
706	China’s president says nuclear weapons must not be used over Ukraine
707	U.S. privately asks Ukraine to show Russia it’s open to negotiation
708	Iran says it shipped drones to Russia before Ukraine war
709	Attackers injure pro-Russia judge who sentenced foreigners to death in Ukraine
710	Power blackouts hit Ukraine amid heavy Russian shelling
711	Attackers injure pro-Russia judge who sentenced foreigners to death in Ukraine
712	General Ben Hodges (Ret.) explains why Ukraine matters
713	Ukraine plans blackouts as it prepares for an extended power outage
714	Zelensky: Good news on air defense and missile defense for Ukraine expected in coming weeks
715	Nuclear weapons must not be used over Ukraine, China’s president says in clear response to Russia
716	Ukraine to raise funds for fleet of marine drones – Zelenskyy
717	Scholz: Xi opposing nuclear weapons in Ukraine reason enough to visit China
718	Judge in Russia-occupied Ukraine in ‘serious’ condition after assassination attempt
719	Ukraine war: Kyiv warns Iran of consequences for supporting Russia
720	Ukraine shares video showing a lone paratrooper single-handedly blowing up a Russian tank
721	Russia Loses Two Ka-52 Attack Helicopters, 12 Drones in a Day: Ukraine
722	Ukraine war: Kyiv warns Iran of consequences for supporting Russia
723	Russian troops loot Kherson as lines redrawn ahead of final battle for city | Ukraine | The Guardian
724	"Tens of thousands of Italians marched through Rome on Saturday calling for peace in Ukraine and urging Italy to stop sending of weapons to fight the Russian invasion. ""No to war. No to sending weapons"", read one large banner carried by protesters"
725	Ukraine is preparing for what may become the most important battle of the war
726	Iran confirms drones to Russia but ‘months’ before Ukraine war
727	Putin signals support for resident evacuation from Kherson, Ukraine
728	Ukraine: 60 British FV103 Spartan armored personnel carriers bought after 36-hour crowdfunding burst raises millions
729	Russian missile strikes overshadow cyberattacks as Ukraine reels from blackouts
730	Iran acknowledges providing drones to Russia before Moscow's invasion of Ukraine
731	Erdogan: Türkiye has shown its diplomatic power during Russia-Ukraine war
732	Ukraine war: Putin endorses evacuations from occupied Kherson
733	The US will pay to refurbish Soviet-era T-72 tanks for Ukraine, which will be the 'most technically advanced tanks on the battlefield'
734	Iran says it supplied drones to Russia before Ukraine war began
735	Russia votes in favour of resolution condemning its actions in Ukraine
736	Iran acknowledges drone shipments to Russia before Ukraine war
737	Xi warns Putin nuclear weapons in Ukraine is a red line. So much for a ‘no limits’ friendship
738	NATO chief hails Türkiye's support to Ukraine, role in fight against terror
739	Russian missile strikes overshadow cyberattacks as Ukraine reels from blackouts
740	Janet Yellen to travel to India, G20 summit as forum struggles with Ukraine war [CNBCTV18]
741	U.S. to send $400 million more military aid to Ukraine
742	Ukraine war: Putin endorses evacuations from occupied Kherson
743	Australian killed fighting for Ukraine
744	/r/WorldNews Live Thread: Russian Invasion of Ukraine Day 255, Part 1 (Thread #396)
745	US military now doing onsite weapons inspections in Ukraine
746	Ukraine suffered a comms outage when 1,300 SpaceX satellite units went offline over funding issues
747	Putin, his commanders and Russia’s nuclear option in Ukraine
748	Hualien man becomes 1st Taiwanese combatant to die in Ukraine war
749	Ukraine brands Jeremy Corbyn one of Putin's 'useful idiots' as he's set to speak at propaganda event
750	First Taiwanese soldier dies fighting for Ukraine
751	Ukraine To Get 90 T-72B Tanks From Czech Republic
752	Defense &amp; National Security — US to fund tanks for Ukraine in $400M package
753	Britain Says Russian Defense Ministry Admits Using Thermobaric Weapons In Ukraine
754	Furious Russians question Putin's plan in Ukraine
755	Russia-Ukraine War: Pentagon Unveils New U.S. Command and More Ukraine Aid
756	Russia threatens retaliation if Israel supplies Ukraine with weapons via third parties
757	Czech Tanks, U.S. And Dutch Money: Three Countries Team Up To Send A Whole Brigade Of T-72s To Ukraine
758	Ukraine issues Crimean Bridge strike stamp on Russia’s Unity Day
759	US, Netherlands go Dutch to refurbish Czech tanks for Ukraine
760	U.S. to send $400 million more military aid to Ukraine
761	Ukraine war: Putin allows former prisoners to be conscripted
762	Marjorie Taylor Greene: GOP won’t give Ukraine ‘another penny’
763	Report: Armed Forces of Ukraine have killed more than 500 Russian prisoners recruited by Wagner private military contractors
764	Ukraine suffered a comms outage when 1,300 SpaceX satellite units went offline over funding issues
765	China’s Xi warns Putin not to use nuclear arms in Ukraine
766	Ukraine suffered a comms outage when 1,300 SpaceX satellite units went offline over funding issues
767	Russia said to threaten retaliation if Israel supplies defense aid to Ukraine
768	Russia said to threaten retaliation if Israel supplies defense aid to Ukraine
769	Netherlands will supply tanks to Ukraine with the Czech Republic and the U.S.
770	Netherlands will supply tanks to Ukraine with the Czech Republic and the U.S.
771	U.S. announces $400 million in new military aid for Ukraine
772	Ukraine suffered a comms outage when 1,300 SpaceX satellite units went offline over funding issues
773	Russia said to threaten retaliation if Israel supplies defense aid to Ukraine
774	Ukraine issues Crimean Bridge strike stamp on Russia’s Unity Day
775	Netherlands to supply Ukraine with tanks and other weapons
776	Czech Republic, USA and The Netherlands to deliver 90 upgraded T-72 tanks to Ukraine
777	G7 diplomats tell Russia to end war in Ukraine 'immediately' | Foreign ministers from the world's major industrialized democracies reiterated their countries' support for Ukraine. They said they would continue providing Kyiv with military and humanitarian support.
778	IAEA Says No Evidence Of Ukraine Using 'Dirty Bomb' Against Russia
779	Russia-Ukraine war: At the front line of Ukraine's struggle for Kherson
780	Microsoft to provide Ukraine with $100 million in tech assistance
781	Xi, Scholz warn against 'irresponsible' nuclear threats over Ukraine
782	Ukraine has the right to retaliate against missile strikes from Belarus
783	Ukraine War 'Warmup' for U.S. in Face of China Threat: Stratcom Commander
784	Scholz to Xi Jinping: Russia’s war in Ukraine causes great issues for the world
785	China's Xi meets Germany's Scholz, urges Ukraine peace talks
786	Zelenskyy mocked Russia after attacks left 4.5 million without power, saying it shows it can't defeat Ukraine on the battlefield
787	Exports of items used in the production of tanks, tyres, and engines from Slovakia can help Russia in war against Ukraine
788	China’s Xi warns Putin not to use nuclear arms in Ukraine
789	700 Dolphins in the Black Sea Have Died Due to the Russia-Ukraine War
790	Ambassadors of ten member states to NATO visit Ukraine
791	Ukraine war: Putin 'waiting for General Winter' to support Russian army, says Borrell
792	Ukraine war: Zelensky accuses Russia of 'energy terrorism'
793	EU considers using Russia’s Central Bank assets to rebuild Ukraine
794	Putin’s troops threatening to shoot Russian army deserters in Ukraine, says UK
795	Russia Dispatches Gigantic 200-Ton Magnet For The Int. Thermonuclear Reactor Despite Tensions Over Ukraine War
796	Putin wants the world to forget Ukraine
797	Nuclear watchdog finds no evidence Ukraine using dirty bomb against Russia
798	/r/WorldNews Live Thread: Russian Invasion of Ukraine Day 254, Part 1 (Thread #395)
799	Russia signals possible Kherson retreat, but Ukraine wary
800	UN nuclear inspectors shut down Russian ‘dirty bomb’ claim against Ukraine
801	1,402 High-Ranking Russian Army Officials Have Died In Ukraine War; 2 Generals Imprisoned
802	US worried that weapons sent to Ukraine could end up in ‘wrong hands’
803	Ukraine war: Zelensky accuses Russia of 'energy terrorism'
804	Ukraine war: Zelensky accuses Russia of 'energy terrorism'
805	EU Studies Use of Russian Central Bank Assets to Rebuild Ukraine
806	Russia signals retreat in southern Ukraine but Kyiv fears trap
807	'How do you reconcile this?' A cameraman's reflection on a harrowing assignment in war-torn Ukraine [Australian Broadcasting Corporation]
808	Sviatlana Tsikhanouskaya: Ukraine has the right to attack Belarus if missiles are launched from its territory again
809	Vladimir Putin set to withdraw forces from Kherson in big setback for his Ukraine invasion, western officials
810	Bulgaria Breaks With Pro-Russia Past, Backs Ukraine Military Aid
811	Russian flag comes down in Kherson, but Ukraine sees a trap
812	Ukraine won’t participate in G20 summit if Putin attends: Zelensky
813	Erdogan tells Zelenskiy ability of Ukraine, Russia to sell grain critical
814	Erdogan tells Zelenskiy ability of Ukraine, Russia to sell grain critical
815	G7 discuss Ukraine support amid attacks on infrastructure | The foreign ministers of the world's wealthiest democracies were meeting in Germany to discuss further cooperation on Ukraine, dependencies on China and Russia, and Iran's police brutality.
816	If Putin goes to G20 summit, Ukraine not to participate in it – Zelenskyy
817	Britain 'too deep' into Ukraine war, Russian ambassador says
818	Vladimir Putin set to withdraw forces from Kherson in big setback for his Ukraine invasion, western officials
819	Bulgarian lawmakers give government month to devise Ukraine military aid plan
820	No sign of ‘dirty bomb’ in Ukraine despite Russian claims: UN nuclear watchdog - National | Globalnews.ca
821	The Ukraine war has often been a grinding artillery battle. These are the big guns being sent in to pound Russian forces.
822	Swiss Again Reject German Request to Re-Export Swiss Ammunition to Ukraine
823	G7 ministers meet with Ukraine war, China ties on agenda
824	G7 to work together on winter aid for Ukraine, Germany says
825	100 drafted Russian soldiers went on strike, refusing to fight in Ukraine after not getting paid, report says
826	Russia is abandoning checkpoints in Ukraine as flags are taken down in Kherson
827	Olena Zelenska says she hopes Musk’s Ukraine peace tweet was ‘chance mistake’ | Ukraine
828	Ukraine shares video of Russian helicopter getting blasted out of the sky, the latest in a string of takedowns
829	Microsoft pledges €100m to support 'technological war' in Ukraine
830	Turkey's President Erdogan is emerging as a power player in Ukraine after brokering an abrupt reversal by Russia
831	Swiss again reject German request to re-export Swiss ammunition to Ukraine
832	Swiss government to provide Ukraine with $100 million winter aid action plan
833	Olena Zelenska says she hopes Musk’s Ukraine peace tweet was ‘chance mistake’ | Ukraine
834	Ukraine: Russian shelling damaged nuclear plant power lines
835	Opinion | It’s Time to Bring Russia and Ukraine to the Negotiating Table
836	Russia, Ukraine to free 214 captured fighters on Thursday - Russian-installed official
837	Iran is preparing to send additional weapons including ballistic missiles to Russia to use in Ukraine, western officials say
838	U.N. Security Council rejects Russia's call to probe debunked U.S.-Ukraine biological weapons claims
839	This war will destroy Russia: Commander-in-Chief compares Russian aircraft losses in Ukraine and Afghanistan
840	Microsoft extends free technology support for Ukraine
841	With Support From US, Ukraine Is Rebuilding Its Navy Into A Force To Reckon With: Report
842	G7 to discuss Ukraine support amid attacks on infrastructure
843	G7 to discuss Ukraine support amid attacks on infrastructure – DW
844	"National Bureau of Investigation: ""No evidence"" that donated weapons have been smuggled from Ukraine to Finland"
845	Russia running out of ammunition and armored vehicles in Ukraine—U.K.
846	While Putin denies war crimes in Ukraine, a Russian soldier confesses to executing a civilian | CBC News
847	Ukraine Warns Iran Of 'Ruthless' Response For Supplying Ballistic Missiles, Drones To Russia
848	Russia's war on Ukraine latest news: nuclear plant disconnected from grid
849	U.S. resumes &amp;#x27;on-site&amp;#x27; inspections to keep track of weapons in Ukraine
850	Ukraine war: Moscow rejoins grain deal; Russian missile strikes continue; and UK sanctions
851	Ukraine updates: UN denies Russia's bioweapons probe call
852	Switzerland has adopted European Union sanctions against an Iranian firm and three top army members for supporting the Russian war against Ukraine.
853	Ukraine conflict, sanctions set to blow hole in Russia's finances
854	Open source intelligence confirms that over 1,400 Russian officers died in Ukraine
855	/r/WorldNews Live Thread: Russian Invasion of Ukraine Day 253, Part 1 (Thread #394)
856	N. Korea covertly supplying artillery shells to Russia for use in Ukraine: White House
857	Russia fails at U.N. in bid for Ukraine, U.S. bioweapons inquiry
858	"Biden threatens oil companies who are ""war-profiteering"" in Ukraine"
859	Russia-Ukraine war at a glance: what we know on day 253 of the invasion | Ukraine
860	The Untold Story of ‘Russiagate’ and the Road to War in Ukraine
861	G7 foreign ministers set to grapple with Ukraine war, China
862	Russian commanders discussed using nuclear arms in Ukraine, says US
863	Putin hammer blow: Ukraine ‘has killed 13,000 Russian soldiers this month’ | World | News
864	Open source intelligence confirms that over 1,400 Russian officers died in Ukraine
865	Boris Johnson says Vladimir Putin 'would be crazy' to use tactical nuclear weapon in Ukraine
866	"National Bureau of Investigation: ""No evidence"" that donated weapons have been smuggled from Ukraine to Finland"
867	Russian commanders discussed using nuclear arms in Ukraine, says US
868	Ukraine Sought Pakistan’s Help For Developing Nuclear Weapons; Delegation Even Travelled To Islamabad – Russian Senator
869	Spain gives to Ukraine SAM battery, 4 Hawk air defence systems, guns and shells
870	Russia and Ukraine war map today 02 November 2022 - 252 day invasion | M...
871	Family of American killed in Ukraine says his body is being held in potential war crimes probe
872	Stopify - Stream a small monthly donation to help the Armed Forces of Ukraine finish the war sooner.
873	Russian military leaders discussed use of tactical nukes against Ukraine, says NYT
874	Ukraine war latest: World on 'brink of nuclear conflict', says Russia
875	Russian generals reportedly discuss using nuclear weapons in Ukraine; Russia rejoins grain deal: Live updates
876	Family of American killed in Ukraine says his body is being held in potential war crimes probe
877	UN chief warmly welcomes Russia decision to end suspension from Ukraine grain deal
878	Russian mercenaries jockey for influence amid military struggles in Ukraine
879	After Turkish mediation, Russia rejoins grain deal with Ukraine guarantees
880	Ukraine war latest: Russian military leaders 'discussed using tactical nuclear weapons'
881	Russian army discussed when, how to use nuclear weapons in Ukraine
882	Russia Says It Will Rejoin Ukraine Grain-Export Deal
883	Russian army discussed when, how to use nuclear weapons in Ukraine -report
884	Russia will rejoin UN grain corridor from Ukraine in humiliating U-turn
885	America’s top Nazi hunter hails bill to allow pursuit of Ukraine war crimes
886	Russia Resumes Ukraine Grain-Export Deal in Abrupt Reversal - Bloomberg
887	Iran to send hundreds of combat drones to Russia in November -Ukraine intel
888	1,000 Russian soldiers killed in 24 hours as Ukraine strikes unequipped troops | 10 points
889	Russia returns to the U.N.-backed deal to ship grain out of Ukraine
890	Oleg Tinkov renounces Russian citizenship over war in Ukraine
891	Russia agrees to resume Ukraine grain deal
892	Russia-Installed Leader in Ukraine Complains About Equipment, Training
893	Food Shortage is already there in many States of America. Including Wheat Crisis amid the cancelation of Ukraine Wheat deal. We are going towards Global Hunger actually.
