	title
1198	Putin claims West seeks global domination by using Ukraine
1199	Slovenian Government: Photo, used by the russian foreign ministry as evidence accusing Ukraine of making a dirty bomb is an ARAO (Slovenian Radioactive Waste Agency) photo from 2010 and published without the knowledge of ARAO
1200	Ukraine attacks Russia’s hold on southern city of Kherson
1201	Russia’s Putin rules out using nuclear weapons in Ukraine
1202	Relaxed Putin shows no regrets as war rages on in Ukraine
1203	Russia's Lavrov holds call with Chinese counterpart, thanks for support on Ukraine
1204	War in Ukraine Likely to Speed, Not Slow, Shift to Clean Energy, I.E.A. Says
1205	Ukraine attacks Russia's hold on southern city of Kherson
1206	Video shows Russian soldiers on the front lines in Ukraine griping about not having enough training, supplies, or food
1207	Russia’s Putin rules out using nuclear weapons in Ukraine
1208	Life of family under Ukraine Russia war
1209	Putin claims war in Ukraine is western plan to secure world domination – video | World news
1210	Putin says ‘no need’ for nuclear weapons as Russia’s war on Ukraine drags on
1211	Ukraine Warns Russia Getting Major Reinforcement on Front Lines
1212	Retreating Russians Might Blow Up Nuclear Power Plant, Ukraine Warns
1213	Russia's Putin rules out using nuclear weapons in Ukraine
1214	Russia's Lavrov holds call with Chinese counterpart, thanks for support on Ukraine
1215	Russia says their SU-57 will shoot down Starlink satellites used to help Ukraine
1216	Putin claims West seeks global domination by using Ukraine
1217	CIA Director Made Secret Visit to Ukraine to Show US Support: CNN
1218	Ukraine live briefing: Putin delivers key speech after repeating unfounded ‘dirty bomb’ claim
1219	Amid Ukraine battles, Putin says West seeks world domination
1220	Ukraine to receive new military aid package from Spain soon, says defense minister
1221	CIA director made a secret visit to Ukraine to meet Zelenskyy and pledge deeper US support, CNN says
1222	Russian women worried about their sons dying in Ukraine should have more babies, influential Orthodox priest says
1223	War in Ukraine Likely to Speed, Not Slow, Shift to Clean Energy, I.E.A. Says
1224	“Extremely dangerous trend”: Russia threatens Starlink over aid to Ukraine
1225	Ukraine war: Russia troop deployment to Belarus prompts speculation
1226	Ukraine intensifies cooperation with Israel in defense sector
1227	Report: Germany pressures Switzerland to re-export tank ammo to Ukraine
1228	Fact Check: Russia's claim that photo shows 'dirty bomb' in Ukraine
1229	Putin says risk of world conflict is 'high'; Moscow official calls for 'de-Satanization' in Ukraine
1230	IMF prepared to finance Ukraine from its drawdown account
1231	Ukraine and Israel are currently “at the beginning of cooperation” now that Israel has given Ukraine intelligence on the Iranian drones that the Kremlin regime uses to attack Ukraine, President Volodymyr Zelenskyy said on Oct. 26.
1232	Russia is actively recruiting convicts of serious crimes for its war against Ukraine in an attempt to replenish its massive losses of troops, the Ukrainian military’s General Staff said in its morning Facebook update on Oct. 27.
1233	Additional German artillery systems handed over to Ukraine
1234	Russia-Ukraine war updates for Oct. 26, 2022
1235	Russia threatens to shoot down Western commercial satellites used to help Ukraine
1236	Russian Foreign Ministry: U.S. satellites could become targets of attack if used in the conflict in Ukraine
1237	Ukraine Reports Russian Strikes on Energy Infrastructure
1238	Ukraine war: Russian tactics on eastern front 'crazy', says Zelensky
1239	Carbon emissions from energy to peak in 2025 in ‘historic turning point’, says IEA | International Energy Agency says Ukraine invasion boosted state spending on clean energy and ‘will accelerate transition to renewables’
1240	Ukraine has boosted its forces near Belarus in case of attack - General Staff
1241	Zelensky: Israel started sharing intelligence with Ukraine
1242	Russian PMCs recruit prisoners convicted for rape and murder to fight in Ukraine
1243	Ukraine at UN calls for immediate investigation into Iranian drones supplies to Russia
1244	Russia says West's Ukraine weapons are going onto the black market
1245	Ukraine war: Russian tactics on eastern front 'crazy', says Zelensky
1246	/r/WorldNews Live Thread: Russian Invasion of Ukraine Day 246, Part 1 (Thread #387)
1247	CIA director traveled to Ukraine earlier this month
1248	Zelensky says Ukraine ‘preparing good news’ in fight against Russia
1249	Russia dismisses reports about 10,000 North Korean volunteers fighting in Ukraine
1250	Ukraine war latest: Authorities exhume around 1,000 bodies in recently liberated territories
1251	As with Ukraine, a coalition should pressure Myanmar's junta, U.N. expert says
1252	Zelensky says Ukraine ‘preparing good news’ in fight against Russia
1253	Before-and-after satellite imagery will track Ukraine cultural damage, UN says | United Nations
1254	''Don't provoke us'': Belarusian propaganda responds to Armed Forces of Ukraine using Kremlin rhetoric
1255	CIA director visited Ukraine this month on classified trip, CNN says
1256	Kremlin-affiliated hackers said to attack Knesset website, citing Ukraine aid
1257	Ukraine Says It Needs More Guns, Shells, and Firepower
1258	Australia sends 70 defense force instructors and another 30 bushmasters to Ukraine.
1259	Ukraine Exhumes Nearly 1,000 Bodies in Liberated Regions
1260	Russia blocks 175 ships operating as part of ‘grain initiative’ – President of Ukraine
1261	Ukraine round-up: Putin watches nuclear tests and a row over a superyacht
1262	Russia conducts first nuclear weapons drill since its invasion of Ukraine
1263	First criminal conviction for opposing war in Ukraine on religious grounds. Would many more priests make the same stand.
1264	Italy's Meloni pledges arms for Ukraine, Berlusconi toes line
1265	I have an idea.. Give Ukraine nuclear missiles. if Russia fires against them, they can fire back against the russian capitals without triggering a full scale nuclear war. Also, here's a puting tiktok:
1266	Putin's top diplomat in the UK says Russia won't use nukes in Ukraine as Moscow spreads baseless 'dirty bomb' claims
1267	The United Nations is using before-and-after satellite imagery to monitor the cultural destruction inflicted by Russia's war in Ukraine, announcing Wednesday it will launch its tracking platform publicly within days
1268	US using Ukraine as 'battering ram' against Russia — Putin
1269	Putin watches first Russian nuclear drill since invasion of Ukraine
1270	Putin's warlord Ramzan Kadyrov declares Ukraine war 'the Big Jihad' and urges Muslims to rise up and fight 'demons' as Russia's security council calls for the country to be 'de-Satanized'
1271	Ukraine alleges Russian operatives are doing 'secret' work at a captured nuclear power plant and could make a dirty bomb
1272	Mercenary chief vented to Putin over Ukraine war bungling
1273	Big Banks and U.N. Green Finance Group Clash in Alliance
1274	Afghan commando unit trained by Britain 'approached by Russia over Whatsapp' to fight in Ukraine
1275	Russia will not use nuclear weapons in Ukraine war, says Andrey Kelin
1276	Only way to peace is helping Ukraine fight, Italy's PM says
1277	Only way to peace is helping Ukraine fight, Italy&amp;#x27;s PM says
1278	Russians Flood Kremlin FAQ Site With Ukraine War Questions
1279	Putin oversees practice drill of 'huge nuclear strike' amid growing fears Russia may trigger major escalation in Ukraine
1280	Israel president gives US intel on Iran drones in Ukraine
1281	Abandoned Russian base holds secrets of retreat in Ukraine
1282	American Joshua Jones's remains turned over to Ukraine; Russia practices 'massive nuclear strike
1283	Russia practices 'massive nuclear strike'; remains of American Joshua Jones turned over to Ukraine: Live updates
1284	Putin watches first Russian nuclear drill since invasion of Ukraine
1285	Ukraine Russia war – latest: Putin oversees drill of ‘massive nuclear strike’
1286	Taiwan pledges US$56 million donation, new scholarship to help Ukraine
1287	Amid 'dirty bomb' threats, India urges Russia, Ukraine to avoid nuclear war at all costs
1288	Breaking: Russia's dirty bomb claims 'absurd' and 'dangerous', says Ukraine
1289	Russia Tells China, India That Ukraine Planning 'Dirty Bomb' Attack
1290	Progressive Democrats retract Biden Ukraine letter after furious debate
1291	Iran Is Now at War With Ukraine
1292	Russia Tells China, India That Ukraine Planning 'Dirty Bomb' Attack
1293	Putin watches first Russian nuclear drill since invasion of Ukraine
1294	Ukraine war: Russia's 'secret work at nuclear plant'; 'Dirty bomb'; Refugees urged to stay away | Euronews
1295	Kremlin says it will keep making case on alleged Ukraine dirty bomb threat
1296	Ukraine says southern counter-offensive complicated by wet weather, terrain
1297	Abandoned Russian base holds secrets of retreat in Ukraine - When Russian troops fled the Ukrainian town of Balakliia last month, they left behind thousands of documents that detail the inner workings of the Russian war machine.
1298	Israel Presenting US With Intelligence on Iranian Drones Used in Ukraine
1299	Russia tells China, India Ukraine planning 'dirty bomb' attack
1300	Russia tells China, India Ukraine planning 'dirty bomb' attack
1301	Ukraine refugees told not to return yet as energy crisis looms | Government tells citizens to wait until spring, amid warning damaged networks ‘will not cope’ as fighting continues
1302	A Russian airport is selling a fake flight experience — with check-in, security, but no take-off — as the Ukraine war roils Russian aviation
1303	Afghan commandos trained by Allied forces are being recruited by RUSSIA to fight in Ukraine
1304	Indian Embassy asks citizens to leave Ukraine
1305	Biden and Sunak vow to support Ukraine and counter China in first call | Rishi Sunak
1306	Putin Admits Russia Is Facing 'Issues' in the Ukraine War
1307	Russians are flooding a Kremlin-run, Quora-style site with anxious questions about the Ukraine war
1308	Russia-Ukraine live news: ‘Heaviest battles’ to come in Kherson | Russia-Ukraine war News
1309	Putin's warlord Ramzan Kadyrov declares Ukraine war 'the Big Jihad' and urges Muslims to rise up and fight 'demons' as Russia's security council calls for the country to be 'de-Satanized'
1310	Cosco gives up shares: Chinese participation in the Port of Duisburg ends
1311	Ukraine war refugees asked not to return this winter
1312	Australia pledges extra $200m in Australian aid for Ukraine
1313	At Pivdenny Buh direction Russian army shelled over 15 settlements across frontline , - General Staff of Armed Forces of Ukraine says in the morning report
1314	Herzog to present Biden with proof Iranian drones being used in Ukraine
1315	Ukraine war: South Africa refuses to seize sanctioned Russian superyacht
1316	Head of Office of President of Ukraine talks to US, UK, French top-level advisers about air defence and security guarantees
1317	Japan PM pledges heating aid to war-hit Ukraine ahead of winter
1318	Ukraine predicts 'heaviest of battles' as Kherson battle lines drawn
1319	Facing Weapons Shortage For Ukraine War, Putin Scrambles To Boost Russia's Arms Production
1320	Putin admits Russia is facing 'issues' in the Ukraine war and told his team to make faster decisions
1321	/r/WorldNews Live Thread: Russian Invasion of Ukraine Day 245, Part 1 (Thread #386)
1322	Russia scrambles to increase weapons production for Ukraine war
1323	Biden and Sunak vow to support Ukraine and counter China in first call
1324	Africa: France Calls for African 'Solidarity' With Europe Over War in Ukraine
1325	Democrats retract call for Biden change of course on Ukraine
1326	Man Arrested In Kazakhstan For Alleged Online Insults Of Kazakhs, Support For Russia's Invasion Of Ukraine
1327	Putin urges his government to 'speed up' decision-making in Ukraine war | CNN
1328	Russia, Ukraine to fight heaviest of battles in Kherson, Kyiv official says
1329	Ukraine-bound NASAMS are in US hands now: Raytheon
1330	Ukraine Situation Report: Russia's Ka-52 Attack Helicopter Fleet Has Been Massacred
1331	Russia, Ukraine to fight 'heaviest of battles' in Kherson -Kyiv official
1332	Ukraine war: Russia troop deployment to Belarus prompts speculation
1333	Ukraine Tells Russian Soldiers 'Thrown to Slaughter' to Surrender
1334	Chechen leader Kadyrov vows to conquer all of Ukraine
1335	Democrats retract call for Biden change of course on Ukraine
1336	Sunak, Zelensky Vow to 'Write a New Chapter' in Ukraine, U.K. Relations
1337	Ukraine alleges Russian dirty bomb deception at nuke plant
1338	"Russia insisted before the UN Security Council Tuesday that Ukraine planned to detonate a ""dirty bomb"" in the war zone, but Western diplomats said Moscow provided no evidence to support the claim"
1339	Jayapal withdraws letter on Ukraine policy amid Democratic anger
1340	Ukraine fears Russia planning false flag attack amid Kremlin’s ‘dirty bomb’ claims – as it happened
1341	Putin cites COVID response in push to accelerate Ukraine war efforts
1342	Russia resorts to recruiting prisoners with infectious diseases: Ukraine
1343	Russia doubles down on 'dirty bomb' accusation against Ukraine
1344	Ukraine war refugees asked not to return this winter
1345	The Remote Control Killers Behind Russia’s Cruise Missile Strikes on Ukraine - bellingcat
1346	Italy not to succumb to Putin's energy blackmail, support for Ukraine to continue - PM Meloni
1347	Sunak Is Appointed As U.K. PM And Vows Support For Ukraine; Kremlin Says It Expects No 'Positive Changes'
1348	The artillery of the Armed Forces of Ukraine hit two Russian tanks with two shots - Militarnyi
1349	Despite Modernization Drive, Russia's Air Force Struggles for Superiority in Ukraine
1350	OSINT investigators identify over 30 Russians programming missiles to strike targets in Ukraine
1351	Russia's Security Council claims there are ''hundreds of sects'' in Ukraine and demands ''desatanisation''
1352	Pope appeals to politicians to avert threat of nuclear war over Ukraine
1353	Russia and USA are Talking Behind Ukraine back
1354	Russia sends fathers who don't pay child support to fight in Ukraine
1355	Russian billionaire behind mercenary army in Ukraine confronted Putin about botching the war, report says
1356	Putin tries to boost decision-making and kit manufacture for Ukraine campaign
1357	Iranian Foreign Minister Hossein Amir-Abdollahian said Tehran is willing to send military experts to Ukraine to investigate allegations of Iran's supply of kamikaze drones to Russia, Iranian news agency IRNA reported on Oct. 24.
1358	Ukraine alleges Russian dirty bomb deception at nuke plant
1359	"Russia says it fears Ukraine will use ""nuclear bomb""—It doesn't have one"
1360	Russia-Ukraine war exposes great libertarian divide over Vladimir Putin support
1361	Ukraine alleges Russian dirty bomb deception at nuke plant
1362	Russian billionaire behind mercenary army in Ukraine confronted Putin about botching the war, report says
1363	UN's Atomic Agency To Visit Ukraine Nuclear Sites As Kyiv And The West Reject Russia's 'Dirty Bomb' Claims
1364	U.S. considers HAWK air defense equipment for Ukraine
1365	Ukraine arms manufacturer charged with treason over bugged phone calls | Ukraine
1366	Ukraine needs foreign aid to build a future apart from Russia, says Kyiv mayor | Vitali Klitschko
1367	United States Democrats Urge Joe Biden to Negotiate with Russia to End Ukraine War
1368	Russia is accused of disrupting the water supply to Mykolaiv in Ukraine
1369	U.S. liberal Democrats urge Biden to seek negotiated Ukraine settlement
1370	Ukraine arms manufacturer charged with treason over bugged phone calls
1371	IAEA to Inspect Nuclear Locations in Ukraine Following Russian Statements
1372	Russia accused of sabotaging Ukraine water pipe to Mykolaiv
1373	What is a âdirty bombâ and why is Russia saying Ukraine could use one?
1374	Russia accused of sabotaging Ukraine water pipe to Mykolaiv
1375	Ukraine: German President Steinmeier arrives in Kyiv – DW
1376	Liberal Democrats call on Biden to shift Ukraine strategy
1377	"Rebuilding Ukraine 'must begin now,' says Germany's Scholz | Germany and the EU are hosting an international conference to discuss the reconstruction of Ukraine, a task that Chancellor Olaf Scholz said is ""never too soon to tackle."""
1378	Ukraine war: Russian forces preparing to defend Kherson, says Ukrainian spy chief
1379	Liberals urge Biden to rethink Ukraine strategy
1380	Russia-Ukraine war live news: Ukraine invites UN nuclear inspectors after discredited ‘dirty bomb’ claim
1381	Ukraine needs foreign aid to build a future apart from Russia, says Kyiv mayor | Vitali Klitschko
1382	Russia brings Ukraine 'dirty bomb' warning to U.N. as it evacuates Kherson
1383	U.S. considers HAWK air defense equipment for Ukraine, say U.S. officials
1384	Exclusive: U.S. considers HAWK air defense equipment for Ukraine, say U.S. officials
1385	Russia accused of sabotaging Ukraine water pipe to Mykolaiv - BBC News
1386	Russia warns NATO countries that Ukraine may use 'Dirty Nuclear Bomb' during the war
1387	30 U.S. House Democrats Urge Biden To Seek Negotiated Settlement To War In Ukraine
1388	Mercenary chief vented to Putin over Ukraine war bungling
1389	Steinmeier arrives in Ukraine first time since Russia launched full-scale invasion
1390	Russia-Ukraine war exposes great libertarian divide over Vladimir Putin support
1391	US Democrats Urge Joe Biden To Negotiate With Russia To End Ukraine War
1392	Ukraine to Orban: Without sanctions pressure and EU help Russian tanks will reach Budapest
1393	/r/WorldNews Live Thread: Russian Invasion of Ukraine Day 244, Part 1 (Thread #385)
1394	Ukraine 'Is Breaking' the Russian Army as War Reaches 8 Months: Zelensky
1395	Liberal Democrats call on Biden to shift Ukraine strategy
1396	Centre for pregnant women fleeing war in Ukraine opens in Kraków, Poland
1397	National leaders gather in Berlin for Ukraine ‘Marshall Plan’
1398	Rotax Engine Found In Iranian Mohajer-6 Drone Downed Over Ukraine
1399	Only 29 percent of GOP voters say US has an obligation to help Ukraine: poll
1400	Young Russians who fled to avoid conscription want to come home. But they refuse to fight in Ukraine.
1401	Ex-US ambassador: Russian war reparations to Ukraine should be in the range of $750 billion to $1 trillion
1402	"Progressives in US House Call for 'Proactive Diplomatic Push' for Ukraine Ceasefire | ""The longer the war in Ukraine goes on, the greater the risk of escalation—to widespread, devastating effect,"" said Rep. Pramila Jayapal."
1403	Ukraine cites success in downing drones, fixes energy sites
1404	Liberals urge Biden to rethink Ukraine strategy
1405	Ukraine Claims Russia Uses Iranian 'Kamikaze' Drones to Save Money
1406	Volodymyr Zelensky: We defended the independence of Ukraine, and Russia cannot change that already, but we still have to go the way to victory
1407	Russia's Wild Claim Ukraine Will Use 'Dirty Bomb' Is a Ploy to Scare the West
1408	Lapid, Ukraine FM talk ‘serious problem’ of Russia-Iran cooperation
1409	Ukraine war: Russian forces preparing to defend Kherson, says Ukrainian spy chief
1410	The Remote Control Killers Behind Russia’s Cruise Missile Strikes on Ukraine - bellingcat
1411	Syria reports Israel-linked air strike hit Iranian drone factory that was producing drones to attack Ukraine
1412	Romanian Defense Minister Resigns Over Comments On Ukraine Needing To Negotiate On War
1413	In Response to Ukraine War, New Independence Movement In Middle Volga Region of Russia
1414	Ukraine Accuses Russia Of Deliberately Delaying Black Sea Grain Exports
1415	Russian ruble being refused in Kherson amid anticipated Ukraine victory
1416	‘Star Wars’ actor Mark Hamill sends 500 drones to Ukraine
1417	NATO Allies Warn Russia Against ‘Dirty Bomb’ Plot in Ukraine
1418	Ukraine should be EU member - Scholz
1419	Some Russians drafted to fight in Ukraine say nobody is in charge and they don't know what they're doing there: report
1420	Deadlier Than Shahed-136, Ukraine Says Iran Now Selling Its 2000 Km Range Arash-2 Drones To Russia
1421	Ukraine 'Increasingly Successful' at Destroying Shahed-136 Drones: U.K.
1422	Ukraine war: Russian spy chief blames West for nuclear tension
1423	Ukraine loses up to 90% of wind, solar energy amid Russia’s invasion, says minister
1424	A group of Iranian instructors have been observed in Belarus, where they may be assisting in the coordination of launching Shahed-136 kamikaze drones at infrastructure facilities in Kyiv and the northern and western regions of Ukraine.
1425	Ukraine - Joint Statement by Foreign Ministers of France, the United Kingdom and the United States (Oct. 24, 22)
1426	Russians Are Feeling the Impact of the Ukraine Conflict-How can it be resolved watch
1427	Ukraine war: Russian spy chief blames West for nuclear tension
1428	Dutch forensic team Ukraine-bound to help investigate war crimes
1429	Ukraine war: Russian spy chief blames West for nuclear tension
1430	Russian Ruble Being Refused in Kherson Amid Anticipated Ukraine Victory
1431	Russia says the West has 'essentially stolen' its foreign currency and gold reserves as the EU eyes asset transfer to Ukraine
1432	Romanian defence minister resigns, pressured after Ukraine comment
1433	U.S. will help Ukraine fight off Iranian-made Russian drones, says Blinken
1434	Budanov suggests Ukraine will regain control over Kherson in 2022
1435	Budanov suggests Ukraine will regain control over Kherson in 2022
1436	French philosopher and filmmaker Bernard-Henri Lévy will present his latest documentary, Why Ukraine, dedicated to events spinning from the Revolution of Dignity to the Russian full-scale invasion of Ukraine. The premiere will be hosted at the United Nations Headquarters, NYC, on Oct. 27.
1437	Ukraine war: Russian spy chief blames West for nuclear tension
1438	Ukraine war heading for ‘uncontrolled escalation’, says Russia
1439	86% of Ukrainians say Ukraine should continue repelling Russian aggression
1440	Germany to deliver three more IRIS-T systems to Ukraine as soon as possible - Scholz
1441	Ukraine war: Kyiv denounces Russia's 'dirty bomb' claims
1442	The biggest war is not in Ukraine but Tigray, where WWI tactics cause 'unbelievable carnage'
1443	Satellite photos reveal fortification plans in Russia-occupied Ukraine: Analysts
1444	Romanian defence minister resigns, pressured after Ukraine comment
1445	Pope, Macron meet at Vatican; Ukraine concerns loom large
1446	Ukraine war: Kyiv denounces Russia&amp;#x27;s &amp;#x27;dirty bomb&amp;#x27; claims
1447	Some Russians drafted to fight in Ukraine say nobody is in charge and they don't know what they're doing there: report
1448	German and EU leaders call for Ukraine 'Marshall Plan'
1449	Russia Accuses Ukraine of Planning to Use Radioactive 'Dirty Bombs'
1450	"Kyiv, U.S. and other allies reject Russian defense chief's claim of ""dirty bomb"" provocation from Ukraine"
1451	The reasons Russia invaded Ukraine
1452	Lithuania, Romania Barred From UNSC Session On Ukraine At Russia's Behest - Source
1453	Ukraine Rejects Russia’s ‘Dirty Bomb’ Claims
1454	Israel gave Ukraine useful intelligence for downing Iranian drones
1455	Ukraine war: Zelenskyy hits back at Russia's 'dirty bomb' claims
1456	Russia accuses Ukraine of planning to use nuclear 'dirty bomb'
1457	Ukraine attempts to push Russia out of Kherson
1458	Ukraine demands compliance with paragraph 4 of Budapest Memorandum, given nuclear blackmail by Russian Federation
1459	Ukraine demands compliance with paragraph 4 of Budapest Memorandum, given nuclear blackmail by Russian Federation
1460	"Russia Hits Homes In Ukraine, Warns Of ""Uncontrolled Escalation"""
1461	/r/WorldNews Live Thread: Russian Invasion of Ukraine Day 243, Part 1 (Thread #384)
1462	US Hypocrisy in Action - Whats the difference between occupation of Ukraine and Palestine?
1463	Russia hits Ukraine homes, evacuates Kherson, warns of escalation
1464	US military forces 'fully prepared' to cross into Ukraine
1465	US dismisses ‘transparently false’ Russian claims of Ukraine plan to use ‘dirty bomb’
1466	Ukraine war: Kyiv denounces Russia's 'dirty bomb' claims
1467	Ukraine war: Kyiv denounces Russia's 'dirty bomb' claims
1468	Ukraine accuses Russia of blocking full implementation of grain deal
1469	Russia-Ukraine war latest: what we know on day 243 of the invasion | Ukraine
1470	Russia-Ukraine war latest: what we know on day 243 of the invasion | Ukraine
1471	Ukraine asks Fingrid for help - Finland's grid operator says Ukraine has requested parts to rebuild critical energy infrastructure damaged by recent drone strikes.
1472	Britain warns Russia against escalating the war in Ukraine after false ‘dirty bomb’ claim
1473	As Russia and Ukraine Seek Gains on Front Line, U.S. and Allies Warn Moscow
1474	Russia goes on defensive as Ukraine beefs up counteroffensive
1475	War in Ukraine: map front line 1.10 - 23.10.2022
1476	False flag? Russia says Ukraine plans to detonate a ‘dirty bomb’ | Russia-Ukraine war News
1477	"Ukraine officials say Russia is planning ""large-scale disaster"" in southern territory - CBS News"
1478	There is a chance for peace in Ukraine: French President Macron
1479	Russian forces could face 'rout' in Kherson; US rejects Russian claim that Ukraine plans radioactive 'provocation'
1480	Ukraine Shoots Down 16 Shahed-136 'Kamikaze' Drones From Iran: Military
1481	Ukraine urges global ban of Russia's RT after presenter calls for drowning of Ukrainian children
1482	Sarkozy Says European Commission Exceeds Mandate By Meddling In Ukraine Arms Supplies
1483	Ukraine Update: Russia claims Ukraine will detonate 'dirty bomb' in weirdest false flag effort yet
1484	Russia's war in Ukraine | CNN
