	title
894	Food Shortage is already there in many States of America. Including Wheat Crisis amid the cancelation of Ukraine Wheat deal. We are going towards Global Hunger actually.
895	Iran sent more than 3,500 drones to Russia for its war against Ukraine: intel dossier
896	Russia Calls UN Security Council Vote On Unfounded Ukraine Biological Weapons Claims
897	Russian army discussed when, how to use nuclear weapons in Ukraine -report
898	Justice Department launches team to investigate war crimes in Ukraine
899	Fresh Drone Attacks In Ukraine Largely Repelled By Air Defenses, Military Says
900	Swiss adopts latest EU drone sanctions over Ukraine war
901	Russia calls vote on unfounded Ukraine biological weapons claims at UNSC
902	US launches demining training project in Ukraine
903	Russian lawmaker who criticized Vladimir Putin's war in Ukraine left comatose after incident inside parliament building
904	Ukraine-Pakistan create nuclear weapon axis, says Russian Senator
905	As electricity is switched off in nine regions of Ukraine, Zelenskyy says Russia will continue energy terror
906	The Unkillable Bomber Regiment: Ukraine Is Restoring More Old Su-24s Than Russia Can Shoot Down
907	Putin's Private Army Facing Legal Action, Accused of Ukraine 'War Crimes'
908	/r/WorldNews Live Thread: Russian Invasion of Ukraine Day 252, Part 1 (Thread #393)
909	Afghan General Says Russia’s Wagner Group Recruiting His Former Troops For Ukraine War
910	anyone can help me understand what will the US troops fight for if involved in the war with Russia? fight for USA people? fight for USA defense industry enterprise? fight for Ukraine? or decrease USA population to increase other USA people's welfare ? As an Asian, we are curious the reason why!
911	U.S. military inspectors in Ukraine to keep further track of weapons and equipment
912	Breaking News: The Pentagon confirms U.S boots in Ukraine
913	Breaking News: The Pentagon confirms U.S boots in Ukraine
914	Ukraine war: Kyiv water supply restored but blackouts remain
915	Ukraine war: Kyiv water supply restored but blackouts remain
916	Ukraine war: Kyiv water supply restored but blackouts remain
917	Billionaire Russian banker renounces citizenship over Ukraine war
918	Russia orders wider evacuation of occupied southern Ukraine
919	Russia Using Kakhovka Dam to Intimidate Civilians Into Evacuation: Ukraine
920	Iran is preparing to send additional weapons including ballistic missiles to Russia to use in Ukraine, western officials say
921	Boris Johnson says Vladimir Putin 'would be crazy' to use tactical nuclear weapon in Ukraine | World News
922	Russia fines Wikimedia Foundation over Ukraine war entries
923	Russia announces wider evacuation of occupied southern Ukraine
924	Russia using Moldova’s airspace to attack Ukraine, Ukrainian air force spokesman says
925	Billionaire Russian banker renounces citizenship over Ukraine war
926	Ukraine Shoots Down 2 Russian 'Alligators' in 3 Minutes: Defense Officials
927	Iran is preparing to send additional weapons including ballistic missiles to Russia to use in Ukraine, western officials say
928	British spies defending Ukraine from Russian cyber attacks, government reveals
929	Ukraine shoots down Russian cruise missile over Moldova
930	Russian journalists defy Putin to report on casualties in Ukraine
931	Medvedev threatens Ukraine with nuclear weapons for liberating its lands
932	Neutrality of Belarus in Russia-Ukraine war not reasonable, says Polish ambassador
933	Ukraine war: Power and water supply hit across Ukraine in 'massive' Russian missile strikes
934	Ships sail from Ukraine despite Russia suspending grain deal
935	Banker Oleg Tinkov renounces Russian citizenship over Ukraine
936	Norway raises military alert in response to Ukraine war.
937	Russia plans to deploy Iranian-made missiles north of Ukraine, against which we have no defence – Air Force spokesman
938	Additional ammunition for HIMARS rocket artillery is included in the new $275 U.S. security assistance package for Ukraine, U.S. Defense Department spokesperson Sabrina Singh said during a press briefing on Oct. 28.
939	Iran is preparing to send additional weapons including ballistic missiles to Russia to use in Ukraine, western officials say
940	Ukraine football federation asks FIFA to remove Iran from World Cup
941	Zelensky: Israel began sharing intelligence with Ukraine
942	Ukraine faces ‘winter humanitarian crisis’ with energy grid on the brink
943	United States to send eight NASAMS to Ukraine — Pentagon
944	Some weapons meant for Ukraine in hands of Finnish criminals, say investigators
945	Russia fines Wikimedia Foundation over Ukraine war entries
946	Ukraine war: Putin suspends Black Sea grain exports deal
947	Russia suspends 'partial mobilization' of citizens for Ukraine war
948	"Billionaire founder of one of Russia's largest banks renounces Russian citizenship over Ukraine. ""I can't and won't be associated with a fascist country that started a war with their peaceful neighbour."""
949	Putin calls large-scale strike on Ukraine revenge for Sevastopol
950	Iran is preparing to send additional weapons including ballistic missiles to Russia to use in Ukraine, western officials say
951	Russia fines Wikipedia owner over Ukraine war entries
952	Russian tycoon Oleg Tinkov renounces citizenship over Ukraine war
953	Russia announces wider evacuation of occupied southern Ukraine
954	Ukraine updates: Klitschko says power, water back in Kyiv – DW
955	Russia announces wider evacuation of occupied southern Ukraine
956	Ukraine war latest: Biden 'lost his temper when Zelenskyy asked for further aid immediately after US confirmed $1bn package'
957	Ukraine Sought Pakistan's Help For Developing Nuclear Weapons; Delegation Even Travelled To Islamabad - Russian Senator
958	"Banker Oleg Tinkov renounces Russian citizenship over Ukraine – ""I can't and won't be associated with a fascist country that started a war with their peaceful neighbour."""
959	Oleg Tinkov renounces Russian citizenship over Ukraine
960	Putin Said To Recruit US-Trained Afghan Soldiers For Ukraine War: 'If We Go Back, Taliban Will Kill Us'
961	Oleg Tinkov, Former Banking Tycoon, Renounces Russian Citizenship Over Ukraine
962	Ukraine War: UK reveals £6m package for cyber defence
963	Ukraine war: Putin suspends Black Sea grain exports deal
964	Oligarch renounces Russian citizenship over Ukraine war
965	BP sees huge profit due to high oil and gas prices – BP has reported a huge profit for July to September due to high oil and gas prices exacerbated by Russia's invasion of Ukraine
966	Ukraine war: British spies playing key role in defending Kyiv from Russian cyber attacks
967	Russian tycoon Oleg Tinkov renounces citizenship over Ukraine war
968	Putin Says 'Necessary Conditions' May Arise for Ukraine Negotiation
969	Ukraine War: UK reveals £6m package for cyber defence
970	Vladimir Putin Urges Ukraine To Ensure Safety Of Maritime Traffic
971	UK Warns Russia Of Severe Consequences Over Nuclear Weapons Use In Ukraine
972	Ukraine War: UK reveals £6m package for cyber defence
973	Banker Oleg Tinkov has given up his Russian citizenship over Ukraine - DPT NEWS
974	Russia suspends 'partial mobilization' of citizens for Ukraine war | CNN
975	/r/WorldNews Live Thread: Russian Invasion of Ukraine Day 251, Part 1 (Thread #392)
976	Ukraine Army Trolls Russia With Ouija Boards To 'Stay Connected' To 71,800 Dead Soldiers
977	US military now doing onsite weapons inspections in Ukraine
978	Kyiv Mayor Vitali Klitschko: 'Please stay with Ukraine'
979	Russia suspends 'partial mobilization' of citizens for Ukraine war
980	Israel to give Ukraine military communication systems
981	World jobs boom halted by Ukraine war and recession risk, says ILO | Global economy
982	Explosions over Kyiv as Russia attacks Ukraine infrastructure
983	Ukraine Resurfaces Putin Body Double Claim, Asks if Russian Leader 'Exists'
984	Grain ships sail from Ukraine ports as Russian missiles knock out power across country
985	Russia recruiting US-trained Afghan commandos to fight in Ukraine
986	Oligarch renounces Russian citizenship over Ukraine war
987	Russia suspends 'partial mobilization' of citizens for Ukraine war
988	Afghan special forces being recruited by Russia to fight in Ukraine
989	Afghan special forces being recruited by Russia to fight in Ukraine
990	Afghan special forces being recruited by Russia to fight in Ukraine | Ukraine
991	Russia suspends 'partial mobilization' of citizens for Ukraine war
992	The Armed Forces of Ukraine destroyed the helicopter of the Russian in the Donetsk region (Video)
993	US military now doing onsite weapons inspections in Ukraine
994	Russia recruits US-trained soldiers; Pentagon focused on halting attacks on Ukraine infrastructure
995	Russia recruits US-trained soldiers; Pentagon focused on halting attacks on Ukraine infrastructure
996	‘Death everywhere’: Documenting atrocities in Ukraine
997	‘Death everywhere’: Documenting atrocities in Ukraine
998	Twelve Countries Help Ukraine Restore Infrastructure after Shelling - Ukraine's Foreign Minister
999	'Battle Between Drones': Ukraine Stocks Up on Latvian Equipment
1000	Russian General Lapin Fired After Ukraine War Criticism: Pro-Kremlin Media
1001	"The war raging in Ukraine and other overlapping crises are taking a toll on labor markets worldwide, the UN said Monday, suggesting a ""sharp"" slowdown was already underway"
1002	Heavy Russian barrage on Ukraine, no water for most of Kyiv
1003	Security Service of Ukraine conducts searches at property of leaders of Ukrainian Orthodox Church of the Moscow Patriarchate in Kirovohrad Oblast
1004	Norway puts military on raised alert level in response to Ukraine war | Norway
1005	Russia Would Agree to Talks to End Ukraine War on These Conditions. Is it finally happening?
1006	Power and water supply hit across Ukraine in massive Russian missile strike
1007	Ukraine: 2 Russian helicopters destroyed in an explosion less than 50 km from Latvia
1008	Russia Accuses West of Trying to Replicate Ukraine Strategy in Armenia
1009	Ukraine ships out record tonnage of grain despite Russia spurning scheme
1010	Heavy Russian barrage on Ukraine, no water for most of Kyiv
1011	Ukraine war: Explosions over Kyiv as Russia targets infrastructure
1012	Ukraine war: Power and water supply hit across Ukraine in &amp;#x27;massive&amp;#x27; Russian missile strikes
1013	Record volumes shipped from Ukraine ports under grain deal on Monday
1014	The Swedish economy is heading into a recession next year, driven by rampant inflation and the war in Ukraine, the country's new finance minister said on Monday.
1015	World jobs boom halted by Ukraine war and recession risk, says ILO | UN body says economic and political crises threaten rise in jobs and hours worked after Covid pandemic
1016	Russia Alleges Ukraine Used Grain Corridor 'Safe Zone' For Drone Attack On Crimea Fleet
1017	Russia alleges Canadian-made parts in drones targeting ships | Russia-Ukraine war News
1018	Russian missiles bombard cities across Ukraine
1019	Grain ships sail despite Moscow's pullout from deal missiles rain on Ukraine
1020	Russian strikes hit Ukraine, most of Kyiv without water
1021	Russia launches 'massive' attack on key infrastructure in Ukraine
1022	Russian strikes hit Ukraine, most of Kyiv without water
1023	Russia-Ukraine war live updates: Power, water outages in Kyiv, key cities after strikes on infrastructure
1024	Russian missile downed by Ukraine lands in Moldovan village - interior ministry
1025	Grain ships sail despite Moscow's pullout from deal; missiles rain on Ukraine
1026	Missiles hit Ukraine’s hydroelectric stations as Russia targets dams | Ukraine
1027	Ukraine war: Wave of 'massive' strikes hits major cities including Kyiv
1028	Ukraine war: Wave of 'massive' strikes hits major cities including Kyiv
1029	Another mass attack on Monday morning: Russia hits energy infrastructure across Ukraine
1030	Ukraine Latest: Russia Hits With Massive Wave of Missile Attacks
1031	Missile strikes reported across Ukraine including capital Kyiv
1032	Russia oil and gas sector won't recover from Putin's Ukraine invasion
1033	/r/WorldNews Live Thread: Russian Invasion of Ukraine Day 250, Part 1 (Thread #391)
1034	tRUTH ABOUT (((UKRAINE))) IS THAT ALL Ukraine IS RRUSSSIA. ALL THE FILTYH HOHOL BANDERITE WHITE SUPREMACITS JEW-KILLING POLE-KILLING AZOVITE ZOGBOT UKRAINE NAZIS CANT CHANGE THAT. CUCKHOLD SOYLENSKYY CANT CHANGE THAT FROM HIS GREEN-SCREEN IN WASHINGTON D.C. DEAL IT WITH IT SOYLOVING REDDITNAZICUCKS
1035	Under Putin's new martial law decree Russian forces can legally loot art in Ukraine
1036	Concerns rise as Russia resumes grain blockade of Ukraine | AP News
1037	'Kill everyone': Russian violence in Ukraine was strategic
1038	Peace Talks with Ukraine should be held in Washington - Dmitry Peskov
1039	Ukraine responds to Russian foreign minister statement on negotiations: the condition for negotiations is an immediate end to war
1040	Tens of hundreds of Czechs demonstrate their aid for Ukraine
1041	Lavrov draws parallels between Ukraine war, Cuban missile crisis
1042	Concerns rise as Russia resumes grain blockade of Ukraine
1043	U.N. says it agreed with Turkey, Ukraine on plan to move 16 vessels under Black Sea grain deal
1044	With Western Weapons, Ukraine Is Turning the Tables in an Artillery War
1045	Russia suspends Ukraine grain deal over ship attack claim - CBS News
1046	Tens of thousands of Czechs show their support for Ukraine
1047	More signs indicate Russia's invasion of Ukraine could be unraveling
1048	Turkish drone company Baykar to develop air-to-air missiles to counter kamikaze drone attacks in Ukraine
1049	Russia's Lavrov needles Biden over Cuban Missile Crisis and Ukraine
1050	Russia Would Agree to Talks to End Ukraine War on These Conditions: Kremlin
1051	Czechs rally against rising extremism and voice support for Ukraine
1052	Global concern on Russia's suspension of Ukraine grain deal
1053	Inside a US military cyber team’s defence of Ukraine
1054	With Western Weapons, Ukraine Is Turning the Tables in an Artillery War
1055	Turkey Says Talks Underway With Russia on Ukraine Grain Deal
1056	U.S. Secretary of State Blinken speaks to E.A.M. Jaishankar; discuss Ukraine war
1057	Global food concerns rise as Russia halts Ukraine grain deal
1058	Ukraine responds to Russian foreign minister’s statement on negotiations: condition is immediate end to war
1059	Russian naval officers discussed nuking Berlin during a training exercise to unnerve Germany and erode support for Ukraine, report says
1060	Russian naval officers discussed nuking Berlin during a training exercise to unnerve Germany and erode support for Ukraine, report says
1061	Russia suspends its participation in UN-brokered grain export deal with Ukraine
1062	Ukraine says Iran’s help for Russia should push Israel out of neutral stance
1063	Ukraine: Top aide urges swift German tank deal
1064	Zelensky: Israel began sharing intelligence with Ukraine
1065	Zelensky: Israel began sharing intelligence with Ukraine
1066	Russia-Ukraine war exposes great libertarian divide over Vladimir Putin support
1067	More signs indicate Russia's invasion of Ukraine could be unraveling
1068	Vladimir Putin’s martial law decree has given Russian forces ‘legal’ cover to loot art in Ukraine
1069	/r/WorldNews Live Thread: Russian Invasion of Ukraine Day 249, Part 1 (Thread #390)
1070	Zelensky invites Meloni to Ukraine
1071	Ukraine questions Twitter takeover amid precarious ties with Musk
1072	Ukraine spy chief says Russian President Vladimir Putin ‘won’t survive the war’
1073	Ukraine War: Russia Panics And Flees Only Dead Soldiers And Weapons Are Left in The Russian Trenches #Ukraine #Fetterman #USA #Germany #Canada …
1074	"Russian TV panelist cut off as he blasts Kremlin's ""sadism"" in Ukraine"
1075	With Western Weapons, Ukraine Is Turning the Tables in an Artillery War
1076	Kazakh-Language Club A Hit With Russian Speakers In Kazakhstan, Amid Ukraine War
1077	The CDC is now tracking a new immune-evasive Omicron variant spiking in Ukraine that’s evading treatment | Fortune
1078	More signs indicate Russia's invasion of Ukraine could be unraveling
1079	Russian TV Panelist Cut Off as He Blasts Kremlin's 'Sadism' in Ukraine
1080	12,000 Russian Troops Were Supposed To Defend Kaliningrad. Then They Went To Ukraine To Die.
1081	Russia says it will suspend UN-brokered Ukraine export deal
1082	Ukraine questions Twitter takeover amid precarious ties with Musk
1083	Russia halts Ukraine Black Sea grain exports, citing attack on Crimea
1084	Russia suspends its participation in UN-brokered grain export deal with Ukraine
1085	Western-made parts found in Iranian drones supplied to Russia for use in Ukraine
1086	Ukraine waits for reactions from Turkey and the UN regarding Russia’s withdrawal from the “grain agreement”
1087	Support Ukraine
1088	"EU can ""transfer"" Russia's frozen billions to compensate Ukraine: Official"
1089	Ukraine war: Russia halts grain deal after 'massive' Black Sea Fleet attack
1090	Russia and Ukraine swap around 50 prisoners of war - officials
1091	Russia halts Ukraine Black Sea grain exports, citing attack on Crimea
1092	Russia Could Start Conscripting Women to Join Ukraine War
1093	Russia suspends participation in deal on Ukraine grain exports: TASS
1094	Russia suspends grain export deal with Ukraine after ‘drone attack’ on Black Sea fleet
1095	Russia-Ukraine updates: Moscow suspends UN-brokered grain export deal
1096	Russia suspends its participation in UN-brokered grain export deal with Ukraine
1097	Russia says it will suspend UN-brokered Ukraine export deal
1098	Russia suspends participation in deal on Ukraine grain exports
1099	Russia says it is suspending a grain export deal with Ukraine
1100	Russia suspends participation in deal on Ukraine grain exports - TASS
1101	Russia's Defense Ministry says the country has moved to suspend the U.N.-brokered grain export deal with Ukraine
1102	Russia-Ukraine war live: UK says Russia peddling false claims over gas pipeline blasts
1103	12,000 Russian Troops Were Supposed To Defend Kaliningrad. Then They Went To Ukraine To Die.
1104	Ukraine conducts another PoW swap with Russia – 52 liberated
1105	Ukraine-type approach required for Myanmar’s military: UN expert | News
1106	Ukraine latest news: Moscow blames UK navy for gas pipeline blasts - as Ukraine says it's 'unlikely' Vladimir Putin will survive war | World News
1107	Russia's hope for Ukraine win revealed in battle for Bakhmut
1108	12,000 Russian Troops Were Supposed To Defend Kaliningrad. Then They Went To Ukraine To Die.
1109	Republicans oppose Democrats’ plan to fund Ukraine with seized Russian assets
1110	Afghan commandos that were trained by US Navy SEALs are being recruited to fight for Russia in Ukraine, report says
1111	Russia Loses 19 Tanks, Two Su-25 Jets and a Helicopter in a Day: Ukraine
1112	Over 300 Iranian-made drones shot down by Ukraine to date - airforce official
1113	Ukraine war: Kyiv set for longer power cuts after air strikes
1114	Armed Forces of Ukraine have killed 70,000 Russian military personnel since beginning of full-scale war
1115	Ukraine minister tells Iranian counterpart: Stop sending weapons
1116	Thousands rally in Prague against pro-Western government: Protesters have called for the Czech government to resign amid rising prices. Many side with Russia over its invasion of Ukraine and antagonism towards NATO
1117	/r/WorldNews Live Thread: Russian Invasion of Ukraine Day 248, Part 1 (Thread #389)
1118	Russian billionaire behind mercenary army in Ukraine confronted Putin about botching the war, report says
1119	Putin says there is ‘no need’ to use nuclear weapons in Ukraine; Biden casts doubt on the claims
1120	Putin says there is ‘no need’ to use nuclear weapons in Ukraine; Biden casts doubt on the claims
1121	Putin says there is ‘no need’ to use nuclear weapons in Ukraine; Biden casts doubt on the claims
1122	Putin says there is ‘no need’ to use nuclear weapons in Ukraine; Biden casts doubt on the claims
1123	Putin says there is ‘no need’ to use nuclear weapons in Ukraine; Biden casts doubt on the claims
1124	Putin says there is ‘no need’ to use nuclear weapons in Ukraine; Biden casts doubt on the claims
1125	Putin says there is ‘no need’ to use nuclear weapons in Ukraine; Biden casts doubt on the claims
1126	Putin says there is ‘no need’ to use nuclear weapons in Ukraine; Biden casts doubt on the claims
1127	Russia declares troop draft done; Ukraine says ‘new wave’ needed
1128	Canada raising money for Ukraine with sale of bonds
1129	Canadians will be able to buy bonds to support Ukraine, prime minister says
1130	Putin pins Ukraine hopes on winter and divisive US politics
1131	Putin 'worried' about South Korea sending weapons to Ukraine
1132	Trudeau announces 35 more Russian sanctions, sale of bonds for Ukraine in Winnipeg
1133	Blackouts worsen in Ukraine; fighting rages on many fronts
1134	Russia: 82,000 conscripts have been sent to fight in Ukraine – video | World news
1135	Russia declares troop draft done; Ukraine says ‘new wave’ needed
1136	Russia: 82,000 conscripts have been sent to fight in Ukraine – video | World news
1137	Russia: 82,000 conscripts have been sent to fight in Ukraine
1138	Russia: 82,000 conscripts have been sent to fight in Ukraine
1139	Zelensky: Israel began sharing intelligence with Ukraine
1140	Blackouts worsen in Ukraine; fighting rages on many fronts
1141	Russia says 82,000 conscripts from emergency draft already in Ukraine | Ukraine
1142	Russia declares end of mobilisation for Ukraine By Reuters
1143	Allegations of Russia's use of white phosphorus bombs in Ukraine
1144	Investigators found Western parts in the Iranian drones Russia has been using to wage war in Ukraine and terrorize its cities
1145	Kremlin Threatens to Hold Ukraine Power Hostage, but Kyiv's Not Buying It
1146	Blackouts worsen in Ukraine; fighting rages on many fronts
1147	'Kill Everyone': Russian Violence in Ukraine Was Strategic
1148	Canada sanctions more Russians, offers bonds for Ukraine
1149	Defense Department announces $275 million military aid to Ukraine
1150	Russia says 82,000 conscripts from emergency draft already in Ukraine | Ukraine
1151	Weapons sent to Ukraine could be used by Russia to fake attacks, U.S. fears
1152	Ukraine war: Russia deploys dozens of drones in two days - Zelensky
1153	War Ukraine – Russia, last minute live
1154	Shoigu announces end of mobilisation: 82,000 conscripts are already in Ukraine
1155	China welcomes Russia’s willingness to hold dialogue over Ukraine war
1156	Trudeau sanctions more Russians, offers sovereignty bonds to support Ukraine
1157	7 minutes ago! Defenders of Ukraine destroyed 19 Shaheds and a cruise mi...
1158	Ukraine: Blackouts back in Kyiv as war takes multiple fronts
1159	Russia could start conscripting women to join Ukraine war
1160	Putin demands US respect ‘multipolar’ world and tell Ukraine to seek peace
1161	Zelenskyy gave his nightly address from a pitch-dark Kyiv as Russian strikes force blackouts on Ukraine
1162	Putin: Russia battling 'Western domination' as Ukraine war grinds on
1163	Chechen leader Kadyrov admits high losses among unit in Ukraine
1164	West says no biological weapons in Ukraine, Russia disagrees
1165	US slams Russia claim of biological weapons in Ukraine as fabrication
1166	Russians Fighting for Ukraine Vow To 'Destroy the Putin Regime'
1167	Ukraine war: Russia deploys dozens of drones in two days - Zelensky
1168	Putin jabs at West over Ukraine war, says operation going to plan
1169	Putin says Russia was forced to intervene in Ukraine to help Donbas
1170	Russia's hope for Ukraine win revealed in battle for Bakhmut
1171	Ukraine Says Moscow Sending 1,000 Reinforcements To Kherson As Fighting Intensifies
1172	Russians Fighting for Ukraine Vow To 'Destroy the Putin Regime'
1173	EU Fears Ukraine War Could Increase Spread Of Illegal Weapons, Seeks Tighter Laws
1174	Ten civilians killed in Russian attacks on Ukraine over past day
1175	Russia will have to answer for Ukraine atrocities: France
1176	Putin says Russia is losing 10 times fewer troops than Ukraine
1177	Zelenskyy says Ukraine has not received 'a single cent' towards $17bn recovery plan | World News
1178	South Korea denies sending weapons to Ukraine after Putin remarks | Russia-Ukraine war News
1179	/r/WorldNews Live Thread: Russian Invasion of Ukraine Day 247, Part 1 (Thread #388)
1180	Russia's Putin says he won't use nuclear weapons in Ukraine
1181	Russia Says U.S. Satellites Assisting Ukraine Are 'Legitimate' Targets
1182	South Korea has not supplied lethal weapons to Ukraine, president says
1183	Zelensky Vows to Escalate Russian Losses as Ukraine Marks Nazi Liberation
1184	South Korea Has Not Supplied Lethal Weapons to Ukraine, President Says -Yonhap
1185	Ukraine Shows 'Cemetery of Russian Missiles and Ammunition' From Strikes
1186	Germany hands over five MARS II MLRS, 14 Panzerhaubitze 2000 howitzers to Ukraine
1187	The Associated Press: Russia's Putin rules out using nuclear weapons in Ukraine.
1188	Russia’s Putin rules out using nuclear weapons in Ukraine
1189	Russia's Putin says he won't use nuclear weapons in Ukraine
1190	Russia recruits Afghan commandos to bolster forces in Ukraine: 'Surprising' effect of US military drawdown
1191	Putin says 'no need' for using nuclear weapons in Ukraine
1192	Putin jabs at West over Ukraine war, says operation going to plan
1193	US will 'hold Russia accountable' if they attack commercial satellites in Ukraine
1194	"Using Nuclear Weapons In Ukraine ""Makes No Sense At All To Us"" Vladimir Putin"
1195	Putin: ‘New world order’ will compensate for Russia’s losses in Ukraine war
1196	Ukraine war: Putin slams the West as 'dangerous, bloody and dirty'
1197	Russia’s Putin rules out using nuclear weapons in Ukraine
